n;id;titulo;canal;categoria;enlace;video_date;video_year;video_mes
1;AF6HyoFlXos;Las Ratitas hacen un McDonalds en el jardín y Gisele le pone Slime y Squishies;Las Ratitas;Videos infantiles;https://www.youtube.com/watch?v=AF6HyoFlXos;2019-01-12T16:28:57Z;2019;1
2;uen40boIYAs;Las Ratitas se maquillan y se ponen uñas de colores;Las Ratitas;Videos infantiles;https://www.youtube.com/watch?v=uen40boIYAs;2019-01-04T17:32:32Z;2019;1
3;B9DrH3sn1_o;Las Ratitas encuentran un esqueleto en casa y aprenden a jugar!!;Las Ratitas;Videos infantiles;https://www.youtube.com/watch?v=B9DrH3sn1_o;2019-01-18T17:42:51Z;2019;1
4;Cb5QqoPS8mA;LARVA  -  EL METRO  -  Película de dibujos animados  -  Dibujos animados para niños  -  WildBrain;WildBrain Niños;Dibujos animados;https://www.youtube.com/watch?v=Cb5QqoPS8mA;2019-01-24T09:00:01Z;2019;1
5;0JE9hmOgQUw;Los cuentos de Minnie: Episodios completos 36-40  -  Disney Junior Oficial;Disney Junior España;Dibujos animados;https://www.youtube.com/watch?v=0JE9hmOgQUw;2019-01-25T10:00:01Z;2019;1
6;CvrlHaeiLIM;"Elsa and Anna toddlers-Barbie&#39;s ambulance toy review";divernic doll adventures;Juguetes;https://www.youtube.com/watch?v=CvrlHaeiLIM;2019-01-17T19:40:03Z;2019;1
7;YbsW0A3KrLg;24 horas embarazada con 100 accesorios para bebé Nenuco Lola y muñecas bebés llorones de juguete;Nenuco Bebe Baby Nenuco;Juguetes;https://www.youtube.com/watch?v=YbsW0A3KrLg;2019-01-11T15:07:49Z;2019;1
8;EQrqoVuqRHk;Mikel y Leo descubren la tecnología Tornado y LetraBots;MikelTube;Vlogs;https://www.youtube.com/watch?v=EQrqoVuqRHk;2019-01-24T19:00:01Z;2019;1
9;lh1qHeUp4Jk;Preparo Biberones para los Bebés en su nueva habitación;Sorpresas Divertidas;Juguetes;https://www.youtube.com/watch?v=lh1qHeUp4Jk;2019-01-18T17:00:12Z;2019;1
10;c6vPn18G9jc;Elsa and Anna toddlers need a snack;divernic doll adventures;Juguetes;https://www.youtube.com/watch?v=c6vPn18G9jc;2019-01-27T19:23:30Z;2019;1
11;0r-2JL_vXqo;Chris Brown - Undecided (Lyrics);Privilege RnB;Música;https://www.youtube.com/watch?v=0r-2JL_vXqo;2019-01-04T06:02:31Z;2019;1
12;msbRUw3g8Rc;Fabricamos Nuestra propia Arcade Casera;MikelTube;Videojuegos;https://www.youtube.com/watch?v=msbRUw3g8Rc;2019-01-12T19:00:12Z;2019;1
13;MLvGB5LYUaU;El Nuevo Castillo de Mikel;MikelTube;Vlogs;https://www.youtube.com/watch?v=MLvGB5LYUaU;2019-01-26T19:00:02Z;2019;1
14;PUf7AsCdX_c;Mi bebé nenuco doctor TEO   Nuevo HAPPY DOCTOR ► 👶 - Bebés de Juguetes en Español;Los Bebes de Lidia;Juguetes;https://www.youtube.com/watch?v=PUf7AsCdX_c;2019-01-15T13:32:50Z;2019;1
15;XiLRMIHvt28;Regalos de Reyes y Cabalgata 2019 con Leo y Mikel;LeoTube;Vlogs;https://www.youtube.com/watch?v=XiLRMIHvt28;2019-01-09T18:58:44Z;2019;1
16;sTEudEaYKM4;Claudia pretend play bebé y Gisele su mamá Las Ratitas;Las Ratitas;Videos infantiles;https://www.youtube.com/watch?v=sTEudEaYKM4;2019-03-02T18:04:44Z;2019;2
17;JGIdfaLljtA;Las Ratitas inflan globos gigantes con colores en ingles!!;Las Ratitas;Videos infantiles;https://www.youtube.com/watch?v=JGIdfaLljtA;2019-02-09T17:05:14Z;2019;2
18;WH66-tJ9wdY;Las Ratitas hacen vestidos de princesas con máquina de coser de juguete para niños;Las Ratitas;Videos infantiles;https://www.youtube.com/watch?v=WH66-tJ9wdY;2019-02-17T16:30:31Z;2019;2
19;xLYxgZlyTHM;Las Ratitas Claudia despierta a Gisele tocando instrumentos de musicales de juguetes;Las Ratitas;Videos infantiles;https://www.youtube.com/watch?v=xLYxgZlyTHM;2019-02-23T17:41:16Z;2019;2
20;xROq-skksc0;LA CAJA MISTERIOSA DE LAS 12 SORPRESAS DE JURASSIC WORLD!! Juguetes y cosas chulas para DANI y EVAN;Las Aventuras de Dani y Evan;Juguetes;https://www.youtube.com/watch?v=xROq-skksc0;2019-03-02T17:37:29Z;2019;2
21;32d1bq-kG5c;"Rosalía canta &#39;Me quedo contigo&#39;  -  Goya 2019";RTVE;Música;https://www.youtube.com/watch?v=32d1bq-kG5c;2019-02-02T21:44:21Z;2019;2
22;y3lkFZ9iO2c;PATRULLA CANINA y el TREN de los HUEVOS SORPRESA GIGANTES! Paw patrol Patrulla de cachorros UNBOXING;Las aventuras de Chía;Juguetes;https://www.youtube.com/watch?v=y3lkFZ9iO2c;2019-02-15T21:03:42Z;2019;2
23;rfWTQ_rfd9s;El disfraz de Leo para Carnaval 2019;LeoTube;Vlogs;https://www.youtube.com/watch?v=rfWTQ_rfd9s;2019-02-22T19:00:07Z;2019;2
24;hJ-uslpR1i4;Una Casa de Locos  -  Llegó el día de los enamorados 💕  -  España  -  Nickelodeon en Español;Nickelodeon en Español;Dibujos animados;https://www.youtube.com/watch?v=hJ-uslpR1i4;2019-02-09T06:00:02Z;2019;2
25;KRZD3OTcnG0;La Bruja nos reta al Donettes Match Challenge;MikelTube;Retos;https://www.youtube.com/watch?v=KRZD3OTcnG0;2019-02-07T19:00:02Z;2019;2
26;AA-SYAWUr_8;Reto 24 HORAS comiendo BARÇA vs REAL MADRID * Comida de los COLORES de TU EQUIPO favorito;The Crazy Haacks;Retos;https://www.youtube.com/watch?v=AA-SYAWUr_8;2019-03-02T19:00:02Z;2019;2
27;YtGvjJ_VcCc;Aprender con Disney Junior: Cuenta hasta 10 con Mickey  -  Disney Junior Oficial;Disney Junior España;Educación infantil;https://www.youtube.com/watch?v=YtGvjJ_VcCc;2019-02-22T10:00:02Z;2019;2
28;ZFYuYpoqfB0;Una Casa de Locos  -  Lori la Tortolita  -  España  -  Nickelodeon en Español;Nickelodeon en Español;Dibujos animados;https://www.youtube.com/watch?v=ZFYuYpoqfB0;2019-03-02T06:30:00Z;2019;2
29;oJUJ0nNXUI8;Elsa and Anna toddlers go shopping at the supermarket and buy toys;Superdoll adventures;Juguetes;https://www.youtube.com/watch?v=oJUJ0nNXUI8;2019-02-04T21:12:23Z;2019;2
30;XOMEeut-f1s;"BABY PETS 👶🐱 Kira Dresses up as Princess Pony  -  Children&#39;s Cartoons";ToonToon Games;Dibujos animados;https://www.youtube.com/watch?v=XOMEeut-f1s;2019-02-07T14:30:03Z;2019;2
31;piIKuebVfPE;Las ratitas encuentran huevos gigantes de colores aprende ingles para niños for kids;Las Ratitas;Videos infantiles;https://www.youtube.com/watch?v=piIKuebVfPE;2019-03-23T17:51:16Z;2019;3
32;sTEudEaYKM4;Claudia pretend play bebé y Gisele su mamá Las Ratitas;Las Ratitas;Videos infantiles;https://www.youtube.com/watch?v=sTEudEaYKM4;2019-03-02T18:04:44Z;2019;3
33;ZV7MMQNVnEg;S2E2: Splits;Step Up: High Water;Series de baile;https://www.youtube.com/watch?v=ZV7MMQNVnEg;2019-03-21T00:57:20Z;2019;3
34;u_VMzsdlyt0;"Sick Song Nursery Rhymes &amp; Kids Songs  -  病気の歌童謡＆キッズソング";Bananas Millions;Música infantil;https://www.youtube.com/watch?v=u_VMzsdlyt0;2019-03-19T08:33:45Z;2019;3
35;q-vp7yW4fGc;Frozen: Mejores momentos - Jugando con la nieve mágica  -  Disney Junior Oficial;Disney Junior España;Dibujos animados;https://www.youtube.com/watch?v=q-vp7yW4fGc;2019-03-14T11:00:07Z;2019;3
36;9AacyLjGU9Q;las ratitas pretend play una puerta de globos de colores aprende ingles para niños for kids;Las Ratitas;Videos infantiles;https://www.youtube.com/watch?v=9AacyLjGU9Q;2019-03-09T15:14:25Z;2019;3
37;L-hpY_DLJZc;Muñeca Rapunzel Grande en su Rutina de Mañana;Sorpresas Divertidas;Juguetes;https://www.youtube.com/watch?v=L-hpY_DLJZc;2019-03-12T17:00:04Z;2019;3
38;D22z-Sf6iHE;¡EL OSCURO SECRETO DE MIKECRACK.EXE!  -  EL FINAL ALTERNATIVO DE SONRÍE MÁS (CÓMIC ANIMADO);Mikecrack;Animación;https://www.youtube.com/watch?v=D22z-Sf6iHE;2019-03-29T23:58:44Z;2019;3
39;W7Og3gBwF-s;Encontramos un Huevo Gigante Breakout Beast;MikelTube;Juguetes;https://www.youtube.com/watch?v=W7Og3gBwF-s;2019-03-21T19:00:02Z;2019;3
40;vtjJVWKeoTM;las ratitas cantan bailan y se peinan en la peluquería video for kids;Las Ratitas;Videos infantiles;https://www.youtube.com/watch?v=vtjJVWKeoTM;2019-03-30T16:56:37Z;2019;3
41;0b8a1_mK0UM;Sorpresas Divertidas de Pocoyo 👶🌈 Abrimos botes Play Doh de colores de Pocoyo;Danny Kenobi;Juguetes;https://www.youtube.com/watch?v=0b8a1_mK0UM;2019-03-18T18:00:01Z;2019;3
42;1dAUI_5Lj18;LAS 1000 VOCES DE MANGEL;elrubiusOMG;Reacciones;https://www.youtube.com/watch?v=1dAUI_5Lj18;2019-03-12T21:04:16Z;2019;3
43;xROq-skksc0;LA CAJA MISTERIOSA DE LAS 12 SORPRESAS DE JURASSIC WORLD!! Juguetes y cosas chulas para DANI y EVAN;Las Aventuras de Dani y Evan;Juguetes;https://www.youtube.com/watch?v=xROq-skksc0;2019-03-02T17:37:29Z;2019;3
44;RbrrvESdH94;Bob Esponja  -  Gary, la reina del drama  -  España  -  Nickelodeon en Español;Nickelodeon en Español;Dibujos animados;https://www.youtube.com/watch?v=RbrrvESdH94;2019-03-23T15:00:02Z;2019;3
45;oD4RWds_vSM;❌ ¡La BEBÉ de RAPUNZEL HA DESAPARECIDO!;Los Juguetes de Luna;Juguetes;https://www.youtube.com/watch?v=oD4RWds_vSM;2019-03-30T14:41:21Z;2019;3
46;dSk5D9pUzMc;Las Ratitas se pintan las uñas en colores pretend play shopping nail polish for kids;Las Ratitas;Videos infantiles;https://www.youtube.com/watch?v=dSk5D9pUzMc;2019-04-27T14:44:55Z;2019;4
47;pS9WoFZxT40;Las Ratitas juegan con huevos gigantes sorpresa de pascua para niños;Las Ratitas;Videos infantiles;https://www.youtube.com/watch?v=pS9WoFZxT40;2019-04-07T11:50:56Z;2019;4
48;qNBjSmhUw74;Muñeca Rapunzel Grande en su rutina de noche 🌙Comiendo Noodles;Sorpresas Divertidas;Juguetes;https://www.youtube.com/watch?v=qNBjSmhUw74;2019-04-06T14:00:09Z;2019;4
49;tECBdRd6xr0;MI CASA EN 5 MINUTOS;elrubiusOMG;Vlogs;https://www.youtube.com/watch?v=tECBdRd6xr0;2019-04-28T20:20:21Z;2019;4
50;ahzY5Xzq5bY;Elsa e Isaac dan rienda suelta a la pasión;Telenovelas;Telenovelas;https://www.youtube.com/watch?v=ahzY5Xzq5bY;2019-04-18T08:05:14Z;2019;4
51;kYFiSWtjMUA;Las ratitas pretend play mcdonalds juegan y bailan videos funny kids compilation;Las Ratitas;Videos infantiles;https://www.youtube.com/watch?v=kYFiSWtjMUA;2019-04-20T15:58:47Z;2019;4
52;gtE8tx3_MQo;Visitamos el Zoo para ver Los Depredadores de La Noche;MikelTube;Vlogs;https://www.youtube.com/watch?v=gtE8tx3_MQo;2019-04-11T18:00:06Z;2019;4
53;En8vI4SYpuw;Hot scene videos,most hot and sexy video,latest bollywood movies;Rina Ashari;Contenido adulto;https://www.youtube.com/watch?v=En8vI4SYpuw;2019-05-01T15:16:01Z;2019;4
54;wMpzOGQncKc;Leo y Mikel conocen al Gato de Pascua y encuentran huevos de chocolate;LeoTube;Vlogs;https://www.youtube.com/watch?v=wMpzOGQncKc;2019-04-19T18:00:05Z;2019;4
55;GQa-id4tg1A;Rapunzel monta su habitación de Princesas;Sorpresas Divertidas;Juguetes;https://www.youtube.com/watch?v=GQa-id4tg1A;2019-04-16T17:28:43Z;2019;4
56;3W5GfRniGcQ;HOT WHEELS VENGADORES vs. THANOS!! DANI y EVAN ENDGAME 💥 Captain Marvel, America, Iron Spider 💥;Las Aventuras de Dani y Evan;Juguetes;https://www.youtube.com/watch?v=3W5GfRniGcQ;2019-04-18T18:06:08Z;2019;4
57;hwZqgpcZUpU;El Poli Mikel y el Bombero Leo descubren los Nuevos PinyPon Action 2019;MikelTube;Juguetes;https://www.youtube.com/watch?v=hwZqgpcZUpU;2019-04-27T18:00:02Z;2019;4
58;ie7EgVV0eZM;DANI Y EVAN y el TESORO de TREASURE X DRAGONS GOLD en el PORTAL OSCURO 😱;Las Aventuras de Dani y Evan;Juguetes;https://www.youtube.com/watch?v=ie7EgVV0eZM;2019-04-20T16:09:39Z;2019;4
59;FlTBD63xrSE;MikelTube Wars 5 El foragido LeoTube;MikelTube;Vlogs;https://www.youtube.com/watch?v=FlTBD63xrSE;2019-04-25T18:00:01Z;2019;4
60;vHx5jdaexh4;DANI y EVAN hacen EXPERIMENTOS y RETOS con SLIME de dinosaurios y el profesor Bizcoche;Las Aventuras de Dani y Evan;Juguetes;https://www.youtube.com/watch?v=vHx5jdaexh4;2019-04-13T17:41:52Z;2019;4
61;mSmugWKxn04;Las Ratitas con su nueva casa de princesas se visten con vestidos;Las Ratitas;Videos infantiles;https://www.youtube.com/watch?v=mSmugWKxn04;2019-05-25T16:30:59Z;2019;5
62;d7LrblxaUlQ;Las Ratitas limpian su casa y comparten sus juguetes pretend play clean toys for kids;Las Ratitas;Videos infantiles;https://www.youtube.com/watch?v=d7LrblxaUlQ;2019-05-11T17:43:32Z;2019;5
63;0qaGPOwUvRk;Elsa se prepara para ir a la escuela pero ¡no quiere bañarse!;Sorpresas Divertidas;Juguetes;https://www.youtube.com/watch?v=0qaGPOwUvRk;2019-05-14T16:00:00Z;2019;5
64;Wvg-6Ti2Vt0;Leo, Mikel,  el coche RC y el rayo modificador de moléculas;LeoTube;Vlogs;https://www.youtube.com/watch?v=Wvg-6Ti2Vt0;2019-05-03T18:00:03Z;2019;5
65;2FpZmf2c2Y8;Las ratitas montan en barco y juegan en el parque;Las Ratitas;Videos infantiles;https://www.youtube.com/watch?v=2FpZmf2c2Y8;2019-05-04T17:12:54Z;2019;5
66;q6kFy2ClH1U;Luisita y Amelia, pasión interrumpida;Telenovelas;Telenovelas;https://www.youtube.com/watch?v=q6kFy2ClH1U;2019-05-03T09:52:36Z;2019;5
67;IGDK3sJJgE0;Mi primer bebé de SILICONA - Abriendo la caja sorpresa de Anuk por CocoReborn;Sorpresas Divertidas;Juguetes;https://www.youtube.com/watch?v=IGDK3sJJgE0;2019-05-23T16:41:13Z;2019;5
68;Z0Q2-mLluSo;Emzikli bebek pamuk şekerin tadını beğenmedi çikolata istedi Asel vermedi #funnyvideo;Asil Asel;Entretenimiento Infantil;https://www.youtube.com/watch?v=Z0Q2-mLluSo;2019-05-29T17:00:04Z;2019;5
69;aufXZ1c5VEg;¡COMO HACER CARAMELOS CASEROS DE MIKECRACK! 🍬💛 LA COCINA DE MIKE #9;Mikecrack;Cocina;https://www.youtube.com/watch?v=aufXZ1c5VEg;2019-05-25T02:29:02Z;2019;5
70;wN0tZiXEnOU;Family Tube #11 La Caja Incorrecta;MikelTube;Vlogs;https://www.youtube.com/watch?v=wN0tZiXEnOU;2019-05-09T18:00:06Z;2019;5
71;En8vI4SYpuw;Hot scene videos,most hot and sexy video,latest bollywood movies;Rina Ashari;Contenido adulto;https://www.youtube.com/watch?v=En8vI4SYpuw;2019-05-01T15:16:01Z;2019;5
72;oiDSJVVIirg;🛁El primer baño de ANUK - Cómo bañar a un reborn de silicona;Sorpresas Divertidas;Juguetes;https://www.youtube.com/watch?v=oiDSJVVIirg;2019-05-30T16:00:11Z;2019;5
73;KZGH53AsXt4;👶👶👶 ¡ RECIBIMOS TRÉS NUEVOS BEBES PRINCESA el MISMO DIA!;Los Juguetes de Luna;Juguetes;https://www.youtube.com/watch?v=KZGH53AsXt4;2019-05-08T13:38:51Z;2019;5
74;tVRAVIjQaLk;"&quot; No No &quot; Bedtime Song Nursery Rhymes for Kids Education video";Bananas Millions;Música infantil;https://www.youtube.com/watch?v=tVRAVIjQaLk;2019-05-25T08:04:10Z;2019;5
75;V3nKbObgF-Y;Es difícil borrar el pasado  -  El diario secreto de una profesional - T1E8;Teleseries y series TVN;Series de televisión;https://www.youtube.com/watch?v=V3nKbObgF-Y;2019-05-08T09:58:43Z;2019;5
76;W6qbobartbc;"Shopping ! Elsa and Anna toddlers buy from Claire&#39;s store - Barbie";Come Play With Me;Juguetes;https://www.youtube.com/watch?v=W6qbobartbc;2019-06-29T16:23:11Z;2019;6
77;315vb9_Axzw;Las Ratitas quieren el mismo vestido videos para niños en español;Las Ratitas;Videos infantiles;https://www.youtube.com/watch?v=315vb9_Axzw;2019-06-08T16:43:21Z;2019;6
78;h_HvCWQVzaw;EID MUBARAK (ঈদ মোবারক) l @ShakibKhanDigital l BUBLY l PASSWORD Movie Festive Song l EID SONG;SK Films;Música;https://www.youtube.com/watch?v=h_HvCWQVzaw;2019-06-01T04:58:49Z;2019;6
79;69A5LIBwXt4;"Kid Dancers Izzy and Easton Dazzle With Contemporary Dance - America&#39;s Got Talent 2019";America's Got Talent;Talentos;https://www.youtube.com/watch?v=69A5LIBwXt4;2019-06-23T13:00:00Z;2019;6
80;pCq1KEOwuSA;Rutina de noche de mis bebés reborn Anuk, Lindea y Leo;Sorpresas Divertidas;Juguetes;https://www.youtube.com/watch?v=pCq1KEOwuSA;2019-06-13T16:00:12Z;2019;6
81;-Kprj7GgNl4;🎤 ¡LA REINA DE YOUTUBE ! 🔥 DIVA YOURSELF CHALLENGE 🎶 KARINA Y MARINA Feat Jose Seron;Karina & Marina;Música;https://www.youtube.com/watch?v=-Kprj7GgNl4;2019-06-01T16:00:00Z;2019;6
82;_4e5FY7f7UI;Elsa and Anna toddlers pool party and challenges;divernic doll adventures;Juguetes;https://www.youtube.com/watch?v=_4e5FY7f7UI;2019-06-07T16:45:04Z;2019;6
83;XUGGQd6jZME;Las ratitas en parque inflable con bolas de colores playing park inflatable ball colors;Las Ratitas;Videos infantiles;https://www.youtube.com/watch?v=XUGGQd6jZME;2019-06-01T16:12:52Z;2019;6
84;A409FxkgvNk;Las Ratitas PRETEND PLAY HOUSE PRINCESS;Las Ratitas;Videos infantiles;https://www.youtube.com/watch?v=A409FxkgvNk;2019-06-22T16:43:32Z;2019;6
85;P71jshPM1Wo;FamilyTube #12 🐈 Este gatito es un Demonio;MikelTube;Vlogs;https://www.youtube.com/watch?v=P71jshPM1Wo;2019-06-08T18:00:02Z;2019;6
86;YnX3dhP71-8;ADIVINA LA SKIN DE FORTNITE POR EL BAILE - FORTNITE CHALLENGE  -  tusadivi;tusadivi;Videojuegos;https://www.youtube.com/watch?v=YnX3dhP71-8;2019-06-04T17:01:26Z;2019;6
87;uK2vS_XYKgQ;Ani y Ona estrenan baño de Frozen y aprenden a bañarse con canciones infantiles;ANI Y ONA;Juguetes;https://www.youtube.com/watch?v=uK2vS_XYKgQ;2019-06-25T14:01:37Z;2019;6
88;nYyqK_i0QXY;LA CAJA MISTERIOSA DE LAS 15 SORPRESAS DE TOY STORY 4 😱de DANI y EVAN;Las Aventuras de Dani y Evan;Juguetes;https://www.youtube.com/watch?v=nYyqK_i0QXY;2019-06-15T19:09:06Z;2019;6
89;weNgHbC8fRU;!LA RULETA DE LA SUERTE EN LA VIDA REAL! 🎯🔫 ELTROLLINO, MIKECRACK Y TIMBAVK;ElTrollino;Live;https://www.youtube.com/watch?v=weNgHbC8fRU;2019-06-27T19:46:54Z;2019;6
90;SmxlEEJlrhg;✈️ ¡Rapunzel y la Sirenita de VIAJE con BEBES en la BARBIE CAMPER POWER WHEELS!;El Club de los Juguetes;Juguetes;https://www.youtube.com/watch?v=SmxlEEJlrhg;2019-06-15T13:00:05Z;2019;6
91;Uzj6IeHmTYo;las ratitas quieren los mismos juguetes en la playa;Las Ratitas;Videos infantiles;https://www.youtube.com/watch?v=Uzj6IeHmTYo;2019-07-06T14:46:56Z;2019;7
92;V_RAbFtIFJo;Las posturas más difíciles del Kamasutra;Psicología Online;Contenido adulto;https://www.youtube.com/watch?v=V_RAbFtIFJo;2019-07-13T17:30:00Z;2019;7
93;KBKZFSuzSj8;Vamos al cole de YouTubers con nuestras Mochilas con ruedas Roller;MikelTube;Vlogs;https://www.youtube.com/watch?v=KBKZFSuzSj8;2019-07-18T18:00:00Z;2019;7
94;jJ9fpR4dw9o;Las Ratitas juegan en el jardín y con el tobogan inflable;Las Ratitas;Videos infantiles;https://www.youtube.com/watch?v=jJ9fpR4dw9o;2019-07-10T14:42:35Z;2019;7
95;e1mmc7RKV_I;Juego de Mesa GIGANTE en LeoTube 🎲;LeoTube;Vlogs;https://www.youtube.com/watch?v=e1mmc7RKV_I;2019-07-19T18:00:06Z;2019;7
96;mKabC0cmi1Q;Bob Esponja  -  Vecinos alborotados  -  España  -  Nickelodeon en Español;Nickelodeon en Español;Dibujos animados;https://www.youtube.com/watch?v=mKabC0cmi1Q;2019-07-27T09:30:02Z;2019;7
97;Nh1Vk1pB06o;Leo y Mikel visitan una Playa en Menorca 🏖️;LeoTube;Vlogs;https://www.youtube.com/watch?v=Nh1Vk1pB06o;2019-07-26T18:00:04Z;2019;7
98;aHFBQj6dxvw;🏰 Construimos un castillo de carton para el gato Bills 👑;MikelTube;Vlogs;https://www.youtube.com/watch?v=aHFBQj6dxvw;2019-07-25T18:00:02Z;2019;7
99;fKFAgDm15jg;EL DÍA MÁS ESPECIAL DE MI VIDA - TheGrefg;TheGrefg;Vlogs;https://www.youtube.com/watch?v=fKFAgDm15jg;2019-07-07T21:19:15Z;2019;7
100;YH5y9myMTkY;ROCKTube Leo y Mikel crean su propia banda de Rock;LeoTube;Vlogs;https://www.youtube.com/watch?v=YH5y9myMTkY;2019-07-05T18:00:04Z;2019;7
101;nVgvqJwAdfU;❌ ¡La SIRENITA está Viviendo  en la PISCINA! │ La Sirenita Disney!;Los Juguetes de Luna;Juguetes;https://www.youtube.com/watch?v=nVgvqJwAdfU;2019-07-27T13:45:00Z;2019;7
102;2e-xgkIOVTY;😨  ¡EXPONIENDO PRINCESAS!  🔥- REVISANDO MOVILES DE LAS PRINCESAS - El Club de los Juguetes;El Club de los Juguetes;Juguetes;https://www.youtube.com/watch?v=2e-xgkIOVTY;2019-07-20T13:00:00Z;2019;7
103;7NJ8g9clug0;Ani y Ona hacen las maletas nos vamos de vacaciones;ANI Y ONA;Vlogs;https://www.youtube.com/watch?v=7NJ8g9clug0;2019-07-10T13:30:01Z;2019;7
104;geSbtIPEXg8;JUGANDO A VUESTROS MAPAS  -  Mario Maker 2;elrubiusOMG;Videojuegos;https://www.youtube.com/watch?v=geSbtIPEXg8;2019-07-21T21:06:35Z;2019;7
105;h-hBi20qbOo;Como Hacer una BALSA BARCA para la PISCINA del MOSASAURIO de Jurassic World!!;Las Aventuras de Dani y Evan;Manualidades;https://www.youtube.com/watch?v=h-hBi20qbOo;2019-07-13T16:00:06Z;2019;7
106;w4_x6ZXQ92s;Las Ratitas convierten juguetes en grandes y pequeños con sus bebés Las Ratitas;Las Ratitas;Videos infantiles;https://www.youtube.com/watch?v=w4_x6ZXQ92s;2019-08-17T14:55:44Z;2019;8
107;k8Zdfh4tFwc;Cambio de look de Las Ratitas con la ruleta SaneuB;SaneuB;Vlogs;https://www.youtube.com/watch?v=k8Zdfh4tFwc;2019-08-30T16:08:40Z;2019;8
108;QsG_xEL-Ll0;LOS ANIMALES JUEGAN AL ESCONDITE ! ENCUÉNTRALOS !;Yolanda Happy School;Educación;https://www.youtube.com/watch?v=QsG_xEL-Ll0;2019-08-22T14:20:56Z;2019;8
109;rrqT2N8tx14;Sexual Positions for Deep Penetration;OneHowto;Contenido adulto;https://www.youtube.com/watch?v=rrqT2N8tx14;2019-08-09T21:00:09Z;2019;8
110;bHv6GXsnNOU;La Casita de Muñecas para Anuk;Sorpresas Divertidas;Juguetes;https://www.youtube.com/watch?v=bHv6GXsnNOU;2019-08-22T14:00:07Z;2019;8
111;qHVPExaSjog;El Juego de las Llaves - Full Tráiler  -  Amazon Prime Video;Prime Video México;Series de televisión;https://www.youtube.com/watch?v=qHVPExaSjog;2019-08-16T02:53:30Z;2019;8
112;GFNhucqEX0M;Caperucita Roja y el Lobo Feroz en Español con Peppa Pig Juguetes 💖 Caperucita Roja Canción;KOKOROKO Cuentos;Juguetes;https://www.youtube.com/watch?v=GFNhucqEX0M;2019-08-02T14:32:22Z;2019;8
113;hu6_2GNE3K4;Pekes VS Grandes 📺;LeoTube;Vlogs;https://www.youtube.com/watch?v=hu6_2GNE3K4;2019-08-30T18:00:06Z;2019;8
114;kbzvZatAfFw;FamilyTube #15 La cuarta edad de Mikel y Leo;MikelTube;Vlogs;https://www.youtube.com/watch?v=kbzvZatAfFw;2019-08-31T18:00:05Z;2019;8
115;jz4-xU_Fb4w;MikelTube Vlog. Nos vamos de Vacaciones  Verano en Menorca 2019;MikelTube;Vlogs;https://www.youtube.com/watch?v=jz4-xU_Fb4w;2019-08-01T18:00:04Z;2019;8
116;ApdJRvgvxgU;El Memecraft;elrubiusOMG;Videojuegos;https://www.youtube.com/watch?v=ApdJRvgvxgU;2019-08-15T20:19:28Z;2019;8
117;7ueHOK57F6Q;Mikel encoge a Leo en su coche 🚘;LeoTube;Vlogs;https://www.youtube.com/watch?v=7ueHOK57F6Q;2019-08-09T18:00:01Z;2019;8
118;diY0yf6iOkc;¡Mira Lo Que Sucede Cuando un Barco Queda Atrapado en una Tormenta!;#Refugio Mental;Entretenimiento informativo;https://www.youtube.com/watch?v=diY0yf6iOkc;2019-08-10T18:15:35Z;2019;8
119;ZFXCk_GDR3g;Pista HOT WHEELS Downhill Race and Go MONSTER TRUCKS con Dani y Evan;Las Aventuras de Dani y Evan;Juguetes;https://www.youtube.com/watch?v=ZFXCk_GDR3g;2019-08-21T16:00:16Z;2019;8
120;9B86t1ts624;Angels- Oc animatic;Hiyoko-chan;Animación;https://www.youtube.com/watch?v=9B86t1ts624;2019-08-31T00:06:41Z;2019;8
121;LfPXoNK7OMg;Amelia y Luisita, deseando recuperar el tiempo perdido;Telenovelas;Telenovelas;https://www.youtube.com/watch?v=LfPXoNK7OMg;2019-10-01T15:25:20Z;2019;9
122;LXFjb1yMUHA;Primer baño en la piscina de ANUK mi bebé Reborn;Sorpresas Divertidas;Juguetes;https://www.youtube.com/watch?v=LXFjb1yMUHA;2019-09-05T15:59:14Z;2019;9
123;YpvU80HI-CE;Nunca digas Mentiras;LeoTube;Vlogs;https://www.youtube.com/watch?v=YpvU80HI-CE;2019-09-27T18:00:04Z;2019;9
124;twcRGM2Z6O0;Los Thunderman  -  ¡Mejores Momentos de Chloe - parte 2!  -  España  -  Nickelodeon en Español;Nickelodeon en Español;Series de televisión;https://www.youtube.com/watch?v=twcRGM2Z6O0;2019-09-14T07:00:08Z;2019;9
125;aju-2o0QrBo;Dani y Evan y los ANIMALES SALVAJES!!  Coleccion LIONS and CO. MAXI EDITION !!;Las Aventuras de Dani y Evan;Juguetes;https://www.youtube.com/watch?v=aju-2o0QrBo;2019-09-21T17:33:23Z;2019;9
126;R1UDQmuOh3Q;TIPOS de ALUMNAS el PRIMER DÍA DE CLASE en la VUELTA AL COLE;Tremending girls;Entretenimiento educativo;https://www.youtube.com/watch?v=R1UDQmuOh3Q;2019-09-13T13:00:06Z;2019;9
127;BXJazZbIt4M;Torneo BAKUGAN en MikelTube;MikelTube;Juguetes;https://www.youtube.com/watch?v=BXJazZbIt4M;2019-09-26T18:00:00Z;2019;9
128;ZeSOIQ7wANA;DANI y EVAN contra la DIMENSION OSCURA en la batalla BAKUGAN BATTLE PLANET;Las Aventuras de Dani y Evan;Juguetes;https://www.youtube.com/watch?v=ZeSOIQ7wANA;2019-09-25T18:02:24Z;2019;9
129;OR_9-BPFCu4;Leo y Mikel encuentran ORO en el Jardín  Minerales del mundo;MikelTube;Vlogs;https://www.youtube.com/watch?v=OR_9-BPFCu4;2019-09-05T18:00:05Z;2019;9
130;m3QpsI5T448;"Elsa and Anna toddlers at the dog&#39;s birthday party";divernic doll adventures;Juguetes;https://www.youtube.com/watch?v=m3QpsI5T448;2019-09-09T16:21:43Z;2019;9
131;xx2VHo4ZJq0;Elsa and Anna toddlers do chores;Superdoll adventures;Juguetes;https://www.youtube.com/watch?v=xx2VHo4ZJq0;2019-09-21T09:44:42Z;2019;9
132;4Rd_Qu-XgKs;Bajar la Líbido  -  Flaps  -  Comedy Central España;Comedy Central España;Comedia;https://www.youtube.com/watch?v=4Rd_Qu-XgKs;2019-09-06T09:00:01Z;2019;9
133;llUca7NFhBk;EL ORIGEN DE IT (ESO)  -  Draw My Life;TikTak Draw;Entretenimiento informativo;https://www.youtube.com/watch?v=llUca7NFhBk;2019-09-04T17:30:00Z;2019;9
134;LkQPLtVA2M0;💊 ¡Las Princesas Bebés NO QUIEREN sus VACUNAS! │ Princesas de Disney Muñecas!;Los Juguetes de Luna;Juguetes;https://www.youtube.com/watch?v=LkQPLtVA2M0;2019-09-25T13:43:55Z;2019;9
135;8cKJPWMN-HQ;FamilyTube #17 Tiburon;MikelTube;Vlogs;https://www.youtube.com/watch?v=8cKJPWMN-HQ;2019-09-21T18:00:01Z;2019;9
136;PEaDWl3Cy9s;Aaj Mangalwar Hai Chuhe Ko Bukhar Hai - FunForKidsTV - Hindi Rhymes;Fun For Kids TV - Hindi Rhymes;Música;https://www.youtube.com/watch?v=PEaDWl3Cy9s;2019-10-16T03:43:57Z;2019;10
137;ReWBBTigURE;LA NIÑA MISTERIOSA CAP. 4 - NO RESPONDE La serie de Las Ratitas;SaneuB;Videos infantiles;https://www.youtube.com/watch?v=ReWBBTigURE;2019-10-12T17:47:03Z;2019;10
138;LfPXoNK7OMg;Amelia y Luisita, deseando recuperar el tiempo perdido;Telenovelas;Telenovelas;https://www.youtube.com/watch?v=LfPXoNK7OMg;2019-10-01T15:25:20Z;2019;10
139;vOuNQJaMCuA;Día de brujas Halloween 2019 en MikelTube;MikelTube;Vlogs;https://www.youtube.com/watch?v=vOuNQJaMCuA;2019-10-26T18:00:05Z;2019;10
140;RNLHfiy0yNc;MikelTube Wars 9 Halloween VS Fortnite 🎃;MikelTube;Vlogs;https://www.youtube.com/watch?v=RNLHfiy0yNc;2019-10-19T18:00:00Z;2019;10
141;0SHIqHrHHPE;LA NIÑA MISTERIOSA CAP. 3 - LA GUARIDA La serie de Las Ratitas;SaneuB;Videos infantiles;https://www.youtube.com/watch?v=0SHIqHrHHPE;2019-10-08T15:47:53Z;2019;10
142;lerrwUZaXJ4;LA NIÑA MISTERIOSA CAP. 2 EL HECHIZO By Las Ratitas;SaneuB;Videos infantiles;https://www.youtube.com/watch?v=lerrwUZaXJ4;2019-10-06T17:03:38Z;2019;10
143;x8TgrMLVRtE;LA NIÑA MISTERIOSA - EL BOSQUE Cap. 1 By Las Ratitas;SaneuB;Videos infantiles;https://www.youtube.com/watch?v=x8TgrMLVRtE;2019-10-04T15:05:51Z;2019;10
144;binQJ-5fgrI;Compramos Regalos de un Color para nuestro Hermanito;MikelTube;Vlogs;https://www.youtube.com/watch?v=binQJ-5fgrI;2019-10-31T19:00:08Z;2019;10
145;rLwA85Urnt8;SPIDERMAN PARKOUR vs PENNYWISE!!! 🎈  -  Prnze;Prnze;Parkour;https://www.youtube.com/watch?v=rLwA85Urnt8;2019-10-31T14:00:16Z;2019;10
