n;id;titulo;canal;categoria;enlace;video_date;video_year;video_mes
296;KBzpsmLdYow;El mayor experto en fugarse de la cárcel;Tri-line;Documentales;https://www.youtube.com/watch?v=KBzpsmLdYow;2020-08-20T19:00:03Z;2020;8
297;Y8Xc-Chvrf0;La Salvamos De Una Muerte Segura;YoSoyPlex;Emocional;https://www.youtube.com/watch?v=Y8Xc-Chvrf0;2020-08-21T18:15:02Z;2020;8
298;um-sary4dQY;Mis bebés NENUCO tienen varicela, les curo y les pongo la vacuna  -  La Guarderia Nenuco #11;Los Bebes de Lidia;Juguetes;https://www.youtube.com/watch?v=um-sary4dQY;2020-08-15T14:00:12Z;2020;8
299;h2_63dvWYio;Rutina de noche de mis bebés NENUCO -  Fiesta de Pijamas  -  La guarderia Nenuco #10;Los Bebes de Lidia;Juguetes;https://www.youtube.com/watch?v=h2_63dvWYio;2020-08-08T14:00:10Z;2020;8
300;aWpDqdvRnRo;🔥¡¡PASO 24 HORAS con MI NOVIO en LA PISCINA !! 🔥 PASO UN DIA CON SAMU por PRIMERA VEZ;Karina & Marina;Vida cotidiana;https://www.youtube.com/watch?v=aWpDqdvRnRo;2020-08-12T16:00:00Z;2020;8
301;QkjFtDZz4Xs;"Yummy Fruits &amp; Vegetables  -  D Billions Kids Songs";D Billions;Música Infantil;https://www.youtube.com/watch?v=QkjFtDZz4Xs;2020-09-16T21:04:42Z;2020;9
302;Vl3swga-Xrk;Would You Rather Have A Giant Diamond or $100,000?;MrBeast;Preguntas y Respuestas;https://www.youtube.com/watch?v=Vl3swga-Xrk;2020-09-26T20:40:02Z;2020;9
303;UMfsc47_09A;Magic Pen Learn Color with Nick and Poli;Nick and Poli - Nursery Rhymes & Kids Songs;Educación Infantil;https://www.youtube.com/watch?v=UMfsc47_09A;2020-09-07T12:00:08Z;2020;9
304;9I2XpbZCyUc;Горшок - Песенки для самых маленьких - Песенка для Детей про горшок Жур Жур;Теремок - Песенки для детей;Música Infantil;https://www.youtube.com/watch?v=9I2XpbZCyUc;2020-09-07T08:45:11Z;2020;9
305;xFSnkgyicVY;Ils étaient ensemble au CP mais il n’a jamais pu l’oublier;La Vie;Historia;https://www.youtube.com/watch?v=xFSnkgyicVY;2020-09-05T06:30:02Z;2020;9
306;8iH6OI2NrOA;Learning Emotions With Blippi at an Indoor Play Place For Kids  -  Educational Videos For Kids;Blippi - Educational Videos for Kids;Educación Infantil;https://www.youtube.com/watch?v=8iH6OI2NrOA;2020-09-17T13:02:55Z;2020;9
307;9i4SKHbhbqk;The Best Fast Food Recipes  -  Part One  -  Gordon Ramsay;Gordon Ramsay;Cocina;https://www.youtube.com/watch?v=9i4SKHbhbqk;2020-09-24T16:00:02Z;2020;9
308;HAzuB77rwB0;Blippi Visits The Bakery  -  Educational Videos For Kids  -  Learning Healthy Eating;Blippi - Educational Videos for Kids;Educación Infantil;https://www.youtube.com/watch?v=HAzuB77rwB0;2020-10-01T13:56:48Z;2020;9
309;YduFDvZqIhQ;"Julie and Luke Perform &quot;Perfect Harmony&quot; Clip  -  Julie and the Phantoms  -  Netflix After School";Netflix After School;Música;https://www.youtube.com/watch?v=YduFDvZqIhQ;2020-09-26T14:00:08Z;2020;9
310;tVesHuKmh6A;Woody escapa en una cometa  -  Toy Story 3  -  Disney Junior Oficial;Disney Junior España;Entretenimiento Infantil;https://www.youtube.com/watch?v=tVesHuKmh6A;2020-09-11T07:13:00Z;2020;9
311;LBKdpWyKlyg;Maddam Sir - Ep 66  - Full Episode - 10th September 2020;Sony SAB;Programas de televisión;https://www.youtube.com/watch?v=LBKdpWyKlyg;2020-09-12T17:00:04Z;2020;9
312;YdnbLR4kRus;SAZÓN® para Pipoca - Baseados em Pedidos Reais – O Filme;sazonajinomoto;Cocina;https://www.youtube.com/watch?v=YdnbLR4kRus;2020-09-15T12:27:06Z;2020;9
313;ndqjxhi7uZs;Binging with Babish: Pollos Hermanos from Breaking Bad;Babish Culinary Universe;Cocina;https://www.youtube.com/watch?v=ndqjxhi7uZs;2020-09-15T13:05:08Z;2020;9
314;G9HTS2JiH9A;"PYRAMID CHAOS! MELTDOWNS, BLOW-UPS &amp; WALKOUTS - Dance Moms (Flashback MEGA-COMPILATION)  -  Lifetime";Lifetime;Programas de televisión;https://www.youtube.com/watch?v=G9HTS2JiH9A;2020-09-16T13:59:49Z;2020;9
315;tuQlF6-ZxZE;نجم الشهر  -  الدببة الثلاثة  -  كرتون نتورك;Cartoon Network MENA;Dibujos animados;https://www.youtube.com/watch?v=tuQlF6-ZxZE;2020-09-26T15:00:19Z;2020;9
316;_21FqhKowec;SI ME HACES REIR TE DOY 1000€;elrubiusOMG;Desafíos;https://www.youtube.com/watch?v=_21FqhKowec;2020-10-11T18:15:24Z;2020;10
317;2M_shyq7gHA;Mikel y Leo aprenden la tecnica Goo Jit Zu;MikelTube;Entretenimiento Infantil;https://www.youtube.com/watch?v=2M_shyq7gHA;2020-10-29T19:00:10Z;2020;10
318;F15KHiJOnB4;🎤 RIVALES EN EL INSTITUTO (Videoclip Oficial) 🎶 ✨NUEVA CANCIÓN de KARINA Y MARINA y Jose Seron;Karina & Marina;Música;https://www.youtube.com/watch?v=F15KHiJOnB4;2020-10-17T16:00:11Z;2020;10
319;EGOBLZNBiVM;Glitter and Gold [ AMV - Mix ] Anime Mix;Sota;Música;https://www.youtube.com/watch?v=EGOBLZNBiVM;2020-10-29T12:43:43Z;2020;10
320;4EPBAoBKPgY;5 TRENDING PHOTOGRAPHY IDEAS in 2020;Jordi Koalitic;Fotografía;https://www.youtube.com/watch?v=4EPBAoBKPgY;2020-10-29T13:57:28Z;2020;10
321;cmkAbDUEoyA;Live Beach Cam Hollywood Beach Broadwalk, Florida;City of Hollywood;Live;https://www.youtube.com/watch?v=cmkAbDUEoyA;2020-10-29T13:19:06Z;2020;10
322;cQ7hypXkOmA;Nuestra propia Nave espacial para ir Más allá de la Luna;MikelTube;Entretenimiento Infantil;https://www.youtube.com/watch?v=cQ7hypXkOmA;2020-10-23T17:00:11Z;2020;10
323;bHfXu2998sA;Nuevo Barco Pirata surca las aguas;LeoTube;Entretenimiento Infantil;https://www.youtube.com/watch?v=bHfXu2998sA;2020-10-23T18:00:09Z;2020;10
324;EPK3ykKfmfg;Los CAZAFANTASMAS Dani y Evan y el Misterio de SLIMER, la PATATA VERDE VISCOSA;Las Aventuras de Dani y Evan;Entretenimiento Infantil;https://www.youtube.com/watch?v=EPK3ykKfmfg;2020-10-31T17:38:37Z;2020;10
325;3oNQ1ZAIZso;Rutina de Viaje con ANI y ONA se van con su amiga Martina MUÑECAS NENUCO;ANI Y ONA;Entretenimiento Infantil;https://www.youtube.com/watch?v=3oNQ1ZAIZso;2020-10-17T14:00:01Z;2020;10
326;YKz1e4IgrJA;Among Us en la Vida Real;MikelTube;Parodia;https://www.youtube.com/watch?v=YKz1e4IgrJA;2020-10-01T18:00:12Z;2020;10
327;qwgTtCXG0Ec;REACCIONANDO A VUESTROS SET-UPS;Ibai;Reacciones;https://www.youtube.com/watch?v=qwgTtCXG0Ec;2020-10-15T20:19:36Z;2020;10
328;0nU-nKyLoYo;🔥#CYPHER V2🔥  -  -  SANTA SALUT, MCKEA, SARA SOCAS, SOFIA GABANNA, KIAMYA (PROD. OSKARKLAP)  -  -  G13 X 4E;4 Elementos;Música;https://www.youtube.com/watch?v=0nU-nKyLoYo;2020-10-25T13:00:13Z;2020;10
329;tOaLZPYnk78;¡PROBANDO COMIDA REAL vs COPIA! 😋🍫 CATA A CIEGAS con el PIRATA ⚡ ¿VALE LA PENA PAGAR MÁS?;Mikecrack;Pruebas y Experimentos;https://www.youtube.com/watch?v=tOaLZPYnk78;2020-10-21T19:31:24Z;2020;10
330;_98BQ3_ngn8;EL ULTIMO EN DEJAR DE COMER LA INICIAL DE SU NOMBRE GANA;Vanesa Basanta;Desafíos;https://www.youtube.com/watch?v=_98BQ3_ngn8;2020-10-30T18:00:11Z;2020;10
331;LwihxyJ4V20;Zero Point Levi  -  Levi Ski Resort  -  Finland;Levi Ski Resort;Viajes;https://www.youtube.com/watch?v=LwihxyJ4V20;2020-11-12T06:50:38Z;2020;11
332;c0VyjNHtjwk;Acacias 38: ¡Ignacio y Alodia SE BESAN apasionadamente en la cocina! #Acacias1378  -  RTVE Series;RTVE Series;Series de televisión;https://www.youtube.com/watch?v=c0VyjNHtjwk;2020-11-28T10:30:02Z;2020;11
333;TNp-GB_0C_U;DESAFIO Hot Wheels INDOMINUS REX SUPER COLOSSAL Jurassic World Camp Cretaceous con DANI y EVAN;Las Aventuras de Dani y Evan;Entretenimiento Infantil;https://www.youtube.com/watch?v=TNp-GB_0C_U;2020-11-18T17:15:11Z;2020;11
334;qhbEk1_iW7g;Experiment: Turbo Skateboard;POWER TEST;Pruebas y Experimentos;https://www.youtube.com/watch?v=qhbEk1_iW7g;2020-11-23T14:00:10Z;2020;11
335;yZWb8B3Dj40;DOY 200€ A QUIEN ME HAGA REÍR  -  SI TE RÍES PIERDES;Ibai;Desafíos;https://www.youtube.com/watch?v=yZWb8B3Dj40;2020-11-28T20:29:01Z;2020;11
336;T6ko9m-a2nQ;REACCIONANDO A WILLYREX FUERA DE CONTEXTO;Ibai;Reacciones;https://www.youtube.com/watch?v=T6ko9m-a2nQ;2020-12-01T22:15:08Z;2020;11
337;KHEE1HPQuI8;Las aventuras de Ladybug en Nueva York: Avance exclusivo  -  Disney Channel Oficial;Disney Channel España;Entretenimiento Infantil;https://www.youtube.com/watch?v=KHEE1HPQuI8;2020-11-18T16:00:06Z;2020;11
338;B7zxQJ274R4;EL FLAMENCO QUE HACE CAQUITA MÁGICA ¿Funciona?  -  JUGUETE Gotta Go Flamingo  -  Curiosidades con Mike;Curiosidades con Mike;Entretenimiento Infantil;https://www.youtube.com/watch?v=B7zxQJ274R4;2020-11-07T20:42:08Z;2020;11
339;4WFymWQimyU;Gisele ayuda a su hermana Claudia a lavarse las manos Las Ratitas;Las Ratitas;Entretenimiento Infantil;https://www.youtube.com/watch?v=4WFymWQimyU;2020-11-12T14:45:10Z;2020;11
340;gsF8uz2WFn4;2 historias reales y ocultas de los pasajeros del Titanic  -  Misterios en el museo;DMAX España;Documentales;https://www.youtube.com/watch?v=gsF8uz2WFn4;2020-11-07T21:00:04Z;2020;11
341;B_snkEGZW0U;ABRO 50 SORPRESAS de BARBIE COLOR REVEAL con Barbies Mágicas y Juguetes  -  Curiosidades con Mike;Curiosidades con Mike;Entretenimiento Infantil;https://www.youtube.com/watch?v=B_snkEGZW0U;2020-11-28T18:03:01Z;2020;11
342;upcdJ6z-wiQ;El Nacimiento de Equipo Danger  -  España  -  Nickelodeon en Español;Nickelodeon en Español;Entretenimiento Infantil;https://www.youtube.com/watch?v=upcdJ6z-wiQ;2020-11-26T16:00:11Z;2020;11
343;3vvVfYLou9A;Revelación De Género FAILS  -  Fiestas De Niño o Niña ...;UVE;Comedia;https://www.youtube.com/watch?v=3vvVfYLou9A;2020-11-18T15:00:03Z;2020;11
344;-ir4InL9aMY;"DAISY&#39;S DESTRUCTION ES REAL Y NO DEBERÍAS VERLO JAMÁS";El Rincón De Giorgio;Informativo;https://www.youtube.com/watch?v=-ir4InL9aMY;2020-11-23T15:18:07Z;2020;11
345;tanWvO18z-I;NO MESSIRVE  -  Memes Reddit #1;Rubius Z;Comedia;https://www.youtube.com/watch?v=tanWvO18z-I;2020-11-06T20:32:25Z;2020;11
346;G1Kicmwv8Ik;¡Ruta completada! Es tu momento Just Eat;Just Eat España;Comida;https://www.youtube.com/watch?v=G1Kicmwv8Ik;2020-12-16T09:15:31Z;2020;12
347;ZdNCgBvvCSM;Skittles MEME: Pop Cat;BENBROS;Comedia;https://www.youtube.com/watch?v=ZdNCgBvvCSM;2020-12-10T19:59:32Z;2020;12
348;h4NJCc4AQxw;REWIND HISPANO 2020 [Alecmolon];Alec Hernández;Recapitulación;https://www.youtube.com/watch?v=h4NJCc4AQxw;2020-12-26T19:00:54Z;2020;12
349;cQSOZ-j8vvU;Anushka Sharma shares her #PregaNewsMeansGoodNews Moment  -  Hindi;Prega News;Publicidad;https://www.youtube.com/watch?v=cQSOZ-j8vvU;2020-12-12T05:29:19Z;2020;12
350;J709tS10FtA;TOP 10 CREATIVE PHOTOS in 2020;Jordi Koalitic;Fotografía;https://www.youtube.com/watch?v=J709tS10FtA;2020-12-17T13:29:08Z;2020;12
351;ku0TYgR3NTw;REACCIONANDO A YOUTUBERS ENSEÑANDO SU CARA POR PRIMERA VEZ;Ibai;Vlogs;https://www.youtube.com/watch?v=ku0TYgR3NTw;2020-12-26T21:19:18Z;2020;12
352;b-rfUUmS3H4;Especial Navidad Leotube Cartoons;LeoTube;Dibujos Animados;https://www.youtube.com/watch?v=b-rfUUmS3H4;2020-12-25T19:00:11Z;2020;12
353;lJLVCa7F-wo;FORTNITE en la vida Real con las Nuevas Nerf en MikelTube;MikelTube;Juegos;https://www.youtube.com/watch?v=lJLVCa7F-wo;2020-12-26T19:00:09Z;2020;12
354;T6ko9m-a2nQ;REACCIONANDO A WILLYREX FUERA DE CONTEXTO;Ibai;Vlogs;https://www.youtube.com/watch?v=T6ko9m-a2nQ;2020-12-01T22:15:08Z;2020;12
355;x2W6_Y5974c;¡COMIDA EN DIBUJOS vs. COMIDA REAL! 😱🍔 ¿PUEDES ENCONTRAR  la DIFERENCIA? ⭐ VIDEO REACCIÓN;Mikecrack;Vlogs;https://www.youtube.com/watch?v=x2W6_Y5974c;2020-12-04T18:00:06Z;2020;12
356;dsr2YlDAv3I;El mundo de Craig  -  Operación: Jessica  -  Boing;Boing España;Dibujos Animados;https://www.youtube.com/watch?v=dsr2YlDAv3I;2020-12-26T19:00:15Z;2020;12
357;FMs82Pf1UC0;Superhero ABC - Learn to write ABC´s with MAGNATAB;Happy Okapi - Educational Videos;Educación Infantil;https://www.youtube.com/watch?v=FMs82Pf1UC0;2020-12-15T11:17:30Z;2020;12
358;FN7eMijTowU;PEINES artesanos a partir de cuernos de animales. Elaboración tradicional en 1997  -  Documental;Eugenio Monesma - Documentales;Documentales;https://www.youtube.com/watch?v=FN7eMijTowU;2020-12-02T12:06:58Z;2020;12
359;Ice0D11Qn8U;As cenas mais quentes da 1ª temporada  -  MTV De Férias Com O Ex Brasil T1;MTV Brasil;Programas de televisión;https://www.youtube.com/watch?v=Ice0D11Qn8U;2020-12-09T18:00:06Z;2020;12
360;MdKN6nKFZz4;SERPIENTE LE MUERDE 12 VECES Y LE DA IGUAL  -  REACCIONANDO A FRANK CUESTA;Ibai;Vlogs;https://www.youtube.com/watch?v=MdKN6nKFZz4;2020-12-09T21:38:49Z;2020;12
361;zNfi9ryIrxg;Khuda Aur Mohabbat  -  OST  -  Rahat Fateh Ali Khan  -  Nish Asher  -  Har Pal Geo;HAR PAL GEO;Música;https://www.youtube.com/watch?v=zNfi9ryIrxg;2021-01-29T15:10:29Z;2021;1
362;C680oxL__ck;I Ate $100,000 Golden Ice Cream;MrBeast;Comida;https://www.youtube.com/watch?v=C680oxL__ck;2021-01-22T21:00:03Z;2021;1
363;YIZ_QFcAFdA;Convierto mi casa en un Restaurante de Las Ratitas;Las Ratitas;Entretenimiento Infantil;https://www.youtube.com/watch?v=YIZ_QFcAFdA;2021-01-17T14:00:12Z;2021;1
364;_yXkEraPg-I;Cuidando de mis Muñecas Elsa y Anna  ¡Un baño para ir a la Escuela!;El Club de los Juguetes;Entretenimiento Infantil;https://www.youtube.com/watch?v=_yXkEraPg-I;2021-01-29T13:57:51Z;2021;1
365;becwdlJrZZo;RUBIUS PUNTUA VUESTROS SETUPS;elrubiusOMG;Vlogs;https://www.youtube.com/watch?v=becwdlJrZZo;2021-01-01T20:49:45Z;2021;1
366;mxePXMkUdBQ;Elsa and Anna toddlers sleepover and fun games;divernic doll adventures;Entretenimiento Infantil;https://www.youtube.com/watch?v=mxePXMkUdBQ;2021-01-29T17:42:53Z;2021;1
367;jwPjn881WlM;ME PERDÍ EN LA NIEVE CON MI HERMANA Y SUS AMIGOS... **desastre**;YoSoyPlex;Vlogs;https://www.youtube.com/watch?v=jwPjn881WlM;2021-01-08T19:15:00Z;2021;1
368;h_IDVuGJ9KI;Convierto mi casa en un restaurante de Gisele y Claudia Las Ratitas;Las Ratitas;Entretenimiento Infantil;https://www.youtube.com/watch?v=h_IDVuGJ9KI;2021-01-29T14:45:10Z;2021;1
369;nqN3Wu2RVs8;EL GIGANTE HOLANDES 2021 - ASI REACCIONA LA GENTE CULTURISTA EN PUBLICO;Victor Valdivia POV;Deportes;https://www.youtube.com/watch?v=nqN3Wu2RVs8;2021-01-27T21:25:29Z;2021;1
370;i28PtSuBfy4;LA MEJOR COLECCION DE CUCHILLOS MAS AFILADOS Y PODEROSOS!! RETO DE CUCHILLOS !! MAKIMAN;Makiman131;Desafíos;https://www.youtube.com/watch?v=i28PtSuBfy4;2021-01-25T18:42:25Z;2021;1
371;ulWO7KRb74Q;SE PEGÓ EN MI OJO!;YoSoyPlex;Vlogs;https://www.youtube.com/watch?v=ulWO7KRb74Q;2021-01-05T19:15:01Z;2021;1
372;rC5r97wRXYQ;LE HAGO UN CAMBIO DE LOOK EXTREMO A MI HERMANA PEQUEÑA!;YoSoyPlex;Vlogs;https://www.youtube.com/watch?v=rC5r97wRXYQ;2021-01-06T19:15:01Z;2021;1
373;--RBg_OPkgA;Aquí no hay quien viva - T5 Capítulo 1: Érase una extradición  -  Capítulo completo;ATRESplayer PREMIUM;Series de televisión;https://www.youtube.com/watch?v=--RBg_OPkgA;2021-01-23T13:00:01Z;2021;1
374;AP0CioTcEtg;Aquí no hay quien viva - T4 Capítulo 1: Érase un despertar  -  Capítulo completo;ATRESplayer PREMIUM;Series de televisión;https://www.youtube.com/watch?v=AP0CioTcEtg;2021-01-22T13:00:03Z;2021;1
375;Uiz_avJ51SY;AMONG US en la vida real con Gisele y Claudia Las Ratitas;Las Ratitas;Entretenimiento Infantil;https://www.youtube.com/watch?v=Uiz_avJ51SY;2021-01-22T14:45:10Z;2021;1
376;e1SVonFKt34;Must Watch New Funny Video 2021_Top New Comedy Video 2021_Try To Not Laugh_Episode-175_By #MyFamily;MY FAMILY;Comedia;https://www.youtube.com/watch?v=e1SVonFKt34;2021-02-24T03:21:09Z;2021;2
377;3U8nS96g3ac;Gisele enseña a Claudia que la oscuridad es divertida Las Ratitas;Las Ratitas;Entretenimiento Infantil;https://www.youtube.com/watch?v=3U8nS96g3ac;2021-02-13T14:45:14Z;2021;2
378;K0L0dbMxm_I;Manualidades de Pocoyó con Play Doh 👶💙🌈 Vídeos para niños;Asubio Kids;Entretenimiento Infantil;https://www.youtube.com/watch?v=K0L0dbMxm_I;2021-02-24T16:00:07Z;2021;2
379;OO33GUJxRJc;360° VR Video SHARK Roller Coaster;Feel Virtual;Realidad virtual;https://www.youtube.com/watch?v=OO33GUJxRJc;2021-02-07T17:36:31Z;2021;2
380;cZhdSmFlGoo;DOY 500€ AL QUE MAS ME HAGA REÍR  -  SI TE RÍES PIERDES;Ibai;Vlogs;https://www.youtube.com/watch?v=cZhdSmFlGoo;2021-02-21T21:27:33Z;2021;2
381;qhow7IoQ95E;Among Us en la Vida Real   -  La Pandilla Junior;Los Juguetes de Luna;Entretenimiento Infantil;https://www.youtube.com/watch?v=qhow7IoQ95E;2021-02-03T15:45:39Z;2021;2
382;Fl3tOhFJeEM;24H COMIENDO EN GASOLINERAS SOLO DE UN COLOR;Vanesa Basanta;Vlogs;https://www.youtube.com/watch?v=Fl3tOhFJeEM;2021-02-19T18:02:16Z;2021;2
383;jsodee3-3tg;NUDE VIDEO BACKSTAGE UNCENSORED (girl in torn pantyhose);NUDE ART PHOTOGRAPHY;Entretenimiento para adultos;https://www.youtube.com/watch?v=jsodee3-3tg;2021-03-01T11:42:27Z;2021;2
384;ceRS87eLZ1c;Bluey:  Inténtalo  -  Disney Junior Oficial;Disney Junior España;Dibujos Animados;https://www.youtube.com/watch?v=ceRS87eLZ1c;2021-02-22T14:00:10Z;2021;2
385;ud35B3-7x-I;En busca de los DINOSAURIOS de JURASSIC WORLD Campamento Cretacico de McDONALDS con Dani y Evan;Las Aventuras de Dani y Evan;Entretenimiento Infantil;https://www.youtube.com/watch?v=ud35B3-7x-I;2021-02-12T16:06:52Z;2021;2
386;YGZLvKAFeYI;This Is It [ AMV - Mix ] Anime Mix;Sota;Arte;https://www.youtube.com/watch?v=YGZLvKAFeYI;2021-02-14T20:42:07Z;2021;2
387;1vJXKfxeLXs;Dibuja y Colorea el Número 1 1️⃣🌈 Aprende los números;Asubio Kids;Educación Infantil;https://www.youtube.com/watch?v=1vJXKfxeLXs;2021-02-08T16:00:00Z;2021;2
388;4jiZf3fQCZc;PROBANDO OBJETOS VIRALES DE TIKTOK! (resultados impactantes);YoSoyPlex;Vlogs;https://www.youtube.com/watch?v=4jiZf3fQCZc;2021-02-02T19:15:00Z;2021;2
389;v3-2oEyRhy4;¡Hago uniformes de la escuela para mis Muñecas Disney!;El Club de los Juguetes;Entretenimiento Infantil;https://www.youtube.com/watch?v=v3-2oEyRhy4;2021-02-26T14:30:04Z;2021;2
390;AkccXbcg2zQ;SOMOS los mejores IMPOSTORES en AMONG US con perro policia 😂😱;Las Aventuras de Dani y Evan;Juegos;https://www.youtube.com/watch?v=AkccXbcg2zQ;2021-02-05T17:38:30Z;2021;2
391;d0dB3kSCMmM;Bhakthi TV Live  -  Telugu Devotional Channel Live  -  Bhakthi TV Official;Bhakthi TV;Programas de televisión;https://www.youtube.com/watch?v=d0dB3kSCMmM;2021-03-18T06:32:28Z;2021;3
392;b7CvqxSPuaI;Fogo de Chao - And Then...  Bone In Ribeye;Fogo de Chão;Comida y bebida;https://www.youtube.com/watch?v=b7CvqxSPuaI;2021-03-08T15:45:50Z;2021;3
393;iZkPipMi2gY;EL ROBO DEL DIAMANTE más GRANDE del MUNDO 💎😍 LAS PERRERÍAS DE MIKE Ep. 13 (Temporada 1);Mikecrack;Comedia;https://www.youtube.com/watch?v=iZkPipMi2gY;2021-03-19T17:00:13Z;2021;3
394;s7wZ62hprTk;¡PINTE A MIS HORMIGAS DE VARIOS COLORES!;Timon se ha Vuelto Loco;Entretenimiento Infantil;https://www.youtube.com/watch?v=s7wZ62hprTk;2021-03-11T20:00:15Z;2021;3
395;1ud7k4i5mAQ;🔥 Cómo Hacer Iniciador de Fuego para Kit de Supervivencia Casero #Shorts;soy Lobo Nómada;Hobbies y manualidades;https://www.youtube.com/watch?v=1ud7k4i5mAQ;2021-03-28T15:13:30Z;2021;3
396;ksdUuFjEPlk;Gisele y Claudia hacen slime Las Ratitas;Las Ratitas;Entretenimiento Infantil;https://www.youtube.com/watch?v=ksdUuFjEPlk;2021-03-13T14:45:14Z;2021;3
397;NCb3tN1PgKY;EL PUZZLE INFINITO ¿QUIÉN CONSEGUIRÁ RESOLVERLO AL 100%?;Cuby;Juego;https://www.youtube.com/watch?v=NCb3tN1PgKY;2021-03-19T19:01:00Z;2021;3
398;G9ndHPkVbj4;CHEF NORUEGO Y SU SEÑORA COCINAN RAMEN;Rubius Z;Comida y bebida;https://www.youtube.com/watch?v=G9ndHPkVbj4;2021-03-28T16:36:34Z;2021;3
399;bwIWFiPertA;ESCAPO de MI NOVIA TÓXICA  -  PERSECUCIÓN de PARKOUR POV;Álex Segura LR;Vlogs;https://www.youtube.com/watch?v=bwIWFiPertA;2021-03-20T14:00:09Z;2021;3
400;SS1vMSny8ks;Si el IMPOSTOR Fuera un Goo Jit Zu;MikelTube;Juegos;https://www.youtube.com/watch?v=SS1vMSny8ks;2021-03-11T19:00:15Z;2021;3
401;jsodee3-3tg;NUDE VIDEO BACKSTAGE UNCENSORED (girl in torn pantyhose);NUDE ART PHOTOGRAPHY;Fotografía de arte desnudo;https://www.youtube.com/watch?v=jsodee3-3tg;2021-03-01T11:42:27Z;2021;3
402;b5RuMs8djho;¿PUEDE UNA ATRAPAMOSCAS ATRAPAR UNA HORMIGA RAPIDA?;Timon se ha Vuelto Loco;Experimentos;https://www.youtube.com/watch?v=b5RuMs8djho;2021-03-23T20:00:05Z;2021;3
403;m5HyigxBstk;SI TE RIES, TIENES QUE REINICIAR ESTE VIDEO !!;UVE;Videos divertidos;https://www.youtube.com/watch?v=m5HyigxBstk;2021-03-25T15:00:14Z;2021;3
404;ZPNQV_3S2Uc;El infierno de Krystal: casi 300 kilos y el síndrome del ovario poliquístico  -  Mi vida con 300 kilos;DMAX España;Documentales;https://www.youtube.com/watch?v=ZPNQV_3S2Uc;2021-03-29T20:00:08Z;2021;3
405;bMVduJ3hlbs;Datos PERTURBADORES De TikTok Que Harán Que Tu Corazón Se Detenga ..;UVE;Curiosidades;https://www.youtube.com/watch?v=bMVduJ3hlbs;2021-03-10T15:00:26Z;2021;3
406;1KIucmaYkmU;TV Aparecida - AO VIVO;TV Aparecida;Live;https://www.youtube.com/watch?v=1KIucmaYkmU;2021-04-13T16:46:16Z;2021;4
407;llJNbN5JJF0;TUS MANOS SE DERRITEN (ilusión óptica) #shorts;Inmagic;Ilusiones ópticas;https://www.youtube.com/watch?v=llJNbN5JJF0;2021-04-05T18:30:22Z;2021;4
408;exo6_NwbCUY;¡MIKE y TROLLI ESCAPAN de la PRISIÓN! 🔫👮‍♂️ Las Perrerías de Mike Ep. 15 (Temporada 1);Mikecrack;Animación;https://www.youtube.com/watch?v=exo6_NwbCUY;2021-04-24T17:00:16Z;2021;4
409;QDTDHd5xRVk;TE LEO LA MENTE (truco de magia) #shorts;Inmagic;Magia;https://www.youtube.com/watch?v=QDTDHd5xRVk;2021-04-03T19:30:55Z;2021;4
410;EFnY_lt4ALE;TU CRUSH TE AMA? (la taza de la verdad) #shorts;Inmagic;Entretenimiento corto;https://www.youtube.com/watch?v=EFnY_lt4ALE;2021-04-29T17:47:31Z;2021;4
411;sDmljXxxS70;¡Le ponemos ESCAYOLA a mi BEBÉ NENUCO CURA SANA con el KIT DE DOCTOR!;Los Bebes de Lidia;Entretenimiento Infantil;https://www.youtube.com/watch?v=sDmljXxxS70;2021-04-23T14:56:14Z;2021;4
412;8vc5YNEK0gw;Un Reto Para Desafiar a Tus Amigos o Familiares/Mika Sofi  Tik Tok viral #shorts;Mika Sofi BOMS;Retos;https://www.youtube.com/watch?v=8vc5YNEK0gw;2021-05-01T18:17:48Z;2021;4
413;DBx1ZYJ4YWs;Dibujo del DÍA DEL BESO 👄🌈 Vídeos para niños;Asubio Kids;Dibujos Animados;https://www.youtube.com/watch?v=DBx1ZYJ4YWs;2021-04-12T15:00:04Z;2021;4
414;wSPODMIK-qM;APRENDE CÓMO LOS MAGOS ADIVINAN TU CARTA #shorts;Inmagic;Magia;https://www.youtube.com/watch?v=wSPODMIK-qM;2021-04-28T16:38:18Z;2021;4
415;IAwi8KhC6MM;TRUCO DE MAGIA SALE MAL (omegle) #shorts;Inmagic;Magia;https://www.youtube.com/watch?v=IAwi8KhC6MM;2021-04-14T18:27:42Z;2021;4
416;mxIZaeGgTsY;EL DIAMANTITO de la SUERTE 💎😱 *TE LEO LA MENTE* ✨ #Shorts;Mikecrack;Animación;https://www.youtube.com/watch?v=mxIZaeGgTsY;2021-04-08T03:04:45Z;2021;4
417;GFevoCwo26E;DOY 300€ AL QUE MAS ME HAGA REÍR  -  SI TE RÍES PIERDES 4;Ibai;Desafíos;https://www.youtube.com/watch?v=GFevoCwo26E;2021-04-07T20:28:16Z;2021;4
418;877y4YTSfMA;DESAFIO VIRAL DE LA SEMANA 😜 DANIELA # Shorts;Daniela Baby Pink;Desafíos;https://www.youtube.com/watch?v=877y4YTSfMA;2021-05-01T13:00:03Z;2021;4
419;n6bv6DoF2RI;EL GRINGO QUE NO SABE INGLÉS (omegle) #shorts;Inmagic;Comedia;https://www.youtube.com/watch?v=n6bv6DoF2RI;2021-04-07T19:00:22Z;2021;4
420;POmJSqVnGSI;Why is Vrbo better for your vacation rental? Guests stay longer.;Vrbo Partners;Anuncios;https://www.youtube.com/watch?v=POmJSqVnGSI;2021-04-28T19:22:36Z;2021;4
421;H3uur6g_9CA;[실시간] 푸른거탑 + 황금거탑 24시간 스트리밍  -  디글클래식;디글 클래식 :Diggle Classic;Videojuegos;https://www.youtube.com/watch?v=H3uur6g_9CA;2021-05-07T07:12:59Z;2021;5
422;VYImJfKISiA;TU NOMBRE TIENE SUERTE? (compruébalo aquí) #shorts;Inmagic;Adivinanzas;https://www.youtube.com/watch?v=VYImJfKISiA;2021-05-23T17:29:11Z;2021;5
423;TPfGXL-fpLM;LA CREACIÓN DE MIKELLINO 😍💘 Las Perrerías de Mike Ep. 16 (Temporada 1);Mikecrack;Animación;https://www.youtube.com/watch?v=TPfGXL-fpLM;2021-05-07T17:15:13Z;2021;5
424;9k_sg8rhsgk;Duluth Canal Cam;Duluth Harbor Cam;Live;https://www.youtube.com/watch?v=9k_sg8rhsgk;2021-05-04T12:58:55Z;2021;5
425;ByGnJ2YuADQ;Gisele y Claudia siguen las pistas de Blue y tu Las Ratitas;Las Ratitas;Entretenimiento Infantil;https://www.youtube.com/watch?v=ByGnJ2YuADQ;2021-05-29T15:45:12Z;2021;5
426;EKKJKCwVTAQ;DIBUJO A MIKECRACK en 10 HORAS / 10 MIN / 10 SEG 😂🎨 MIKECRACK vs PROFESIONAL 🖌 ¿QUIÉN DIBUJA MEJOR?;Mikecrack;Arte;https://www.youtube.com/watch?v=EKKJKCwVTAQ;2021-05-30T02:48:38Z;2021;5
427;4FayK3J4oX4;24h en Casita par Perros  ALGO SALE MAL;MikelTube;Vlogs;https://www.youtube.com/watch?v=4FayK3J4oX4;2021-05-13T18:30:13Z;2021;5
428;jgiDyp3XNB4;LO IMPORTANTE NO ES CAER, SI NO LEVANTARSE ⭐ BRIHUEGA ⭐ Certamen ▶ Cortes con TOROS ◀ 4K;TOROS EN ESPAÑA TV;ortes con Toros;https://www.youtube.com/watch?v=jgiDyp3XNB4;2021-05-24T14:55:19Z;2021;5
429;NFEUpKEzL_s;LE DOY CARNE A MI LOBO POR PRIMERA VEZ!;YoSoyPlex;Vlogs;https://www.youtube.com/watch?v=NFEUpKEzL_s;2021-05-12T18:15:00Z;2021;5
430;1XbfDbGOCNk;Imitando a TikTokers famosas;Tremending girls;Comedia;https://www.youtube.com/watch?v=1XbfDbGOCNk;2021-05-14T17:00:17Z;2021;5
431;RWDVW5VI2Nc;DANI y EVAN y los GOO JIT ZU de MARVEL y DINOSAURIOS;Las Aventuras de Dani y Evan;Entretenimiento Infantil;https://www.youtube.com/watch?v=RWDVW5VI2Nc;2021-05-28T16:00:31Z;2021;5
432;i0lMr5OnHfw;INTERCAMBIO de VIDAS!! OMG!!;Hermanos Tremending;Comedia;https://www.youtube.com/watch?v=i0lMr5OnHfw;2021-05-15T17:00:14Z;2021;5
433;MfcRfEYde-E;Bluey: Compilado Momentos Entrañables  -  Disney Junior Oficial;Disney Junior España;Dibujos Animados;https://www.youtube.com/watch?v=MfcRfEYde-E;2021-05-24T15:30:03Z;2021;5
434;zHbNyTjSTa4;¡HICE FUENTE de CHOCOLATE con 36 KINDER SORPRESA!;Timon se ha Vuelto Loco;Cocina;https://www.youtube.com/watch?v=zHbNyTjSTa4;2021-05-07T20:00:11Z;2021;5
435;GJCbkg3jh3I;Somos GODZILLA y luchamos contra KAIJUS en ROBLOX!!;Las Aventuras de Dani y Evan;Juegos;https://www.youtube.com/watch?v=GJCbkg3jh3I;2021-05-04T16:00:05Z;2021;5
436;beFyDHbPyu8;LA VENGANZA DEL EXE - SONRÍE MÁS 2 😱💔 LAS PERRERÍAS DE MIKE Ep. 19 (Temporada 1);Mikecrack;Animación;https://www.youtube.com/watch?v=beFyDHbPyu8;2021-06-25T20:00:09Z;2021;6
437;5t8-7GPraw8;TOP 5 Photography Tricks in 2021;Jordi Koalitic;Fotografía;https://www.youtube.com/watch?v=5t8-7GPraw8;2021-06-10T12:28:57Z;2021;6
438;S-_KD5QR9F4;MAÑANAS DE SÁBADO MINION  -  Episodio 2: Locuras en la piscina (Illumination Entertainment) HD;Illumination Spain;Películas animadas;https://www.youtube.com/watch?v=S-_KD5QR9F4;2021-06-19T05:00:06Z;2021;6
439;EO86uYdnwK4;"Lay&#39;s: Sencillamente irresistibles";LaysESP;Anuncios;https://www.youtube.com/watch?v=EO86uYdnwK4;2021-06-16T15:09:40Z;2021;6
