n;id;titulo;canal;enlace;fecha;anyo;mes;posicion;cat;deporte
295;uVmqsrheJgM;EDU AGUIRRE DESATADO tras la HUMILLACIÓN del BARÇA;El Chiringuito de Jugones;https://www.youtube.com/watch?v=uVmqsrheJgM;2020-08-14T23:08:22Z;2020;8;10;17;Fútbol
296;xNXcOU8lM2s;GANAR FLEXIBILIDAD | EJERCICIOS DE ESTIRAMIENTOS;gymvirtual;https://www.youtube.com/watch?v=xNXcOU8lM2s;2020-08-26T16:45:10Z;2020;8;11;17;Fitness
297;iXQhASFfI4Y;ZUMBA para BAJAR de PESO en CASA 🔥🔥🔥 MERENGUE CARDIO 🔥🔥🔥🎵TOP MUSIC🎵 BEAT FIT 30 MINUTOS;Entrena con Rosa Fitness;https://www.youtube.com/watch?v=iXQhASFfI4Y;2020-08-23T18:00:14Z;2020;8;12;17;Fitness
298;VCcar3MA07w;15 Min FULL BODY KETTLEBELL WORKOUT at Home | Caroline Girvan;Caroline Girvan;https://www.youtube.com/watch?v=VCcar3MA07w;2020-08-08T13:00:28Z;2020;8;13;17;Fitness
299;FgWrOroT3DE;2020 Belgian Grand Prix: Qualifying Highlights;FORMULA 1;https://www.youtube.com/watch?v=FgWrOroT3DE;2020-08-29T15:04:41Z;2020;8;14;17;Automovilismo
300;tS01JLqO2B8;Lose Belly Fat Sitting Down | AB WORKOUT For Women Over 50!;fabulous50s;https://www.youtube.com/watch?v=tS01JLqO2B8;2020-08-12T08:54:02Z;2020;8;15;17;Fitness
301;bX48fxYRGgo;Pértiga Mujeres Meeting Barcelona 2020;La Bolsa del Corredor;https://www.youtube.com/watch?v=bX48fxYRGgo;2020-09-23T18:51:51Z;2020;9;1;17;Atletismo
302;iIovgwl5-aY;"From the Vault: Ishant&#39;s iconic WACA spell to Ponting";cricket.com.au;https://www.youtube.com/watch?v=iIovgwl5-aY;2020-09-02T09:00:27Z;2020;9;2;17;Cricket
303;GJ4gMzrM0BQ;Pool Lesson | Every Possible Way To Run A Rack - GoPro;Sharivari;https://www.youtube.com/watch?v=GJ4gMzrM0BQ;2020-09-10T10:19:42Z;2020;9;3;17;Billar
304;3eveyXm-450;Elimina la Grasa Debajo del Sujetador y de la Axila | Ejercicios de Espalda Alta;Susana Yábar;https://www.youtube.com/watch?v=3eveyXm-450;2020-09-30T16:00:01Z;2020;9;4;17;Fitness
305;BRDKvdK9J0s;"Valentino Rossi&#39;s Top 10 Moments at Yamaha Factory Racing";MotoGP;https://www.youtube.com/watch?v=BRDKvdK9J0s;2020-09-26T11:30:00Z;2020;9;5;17;Motociclismo
306;e26BeTHdSQE;Allen Iverson | Ep 46 | ALL THE SMOKE Full Episode | SHOWTIME Basketball;SHOWTIME Basketball;https://www.youtube.com/watch?v=e26BeTHdSQE;2020-09-24T16:00:07Z;2020;9;6;17;Baloncesto
307;Ve3H4tYj47c;"Yao Ming&#39;s Top 40 | Career Plays";NBA;https://www.youtube.com/watch?v=Ve3H4tYj47c;2020-09-12T12:00:05Z;2020;9;7;17;Baloncesto
308;-t0h8GOZCMY;NIÑOS INVIDENTES CONOCEN a MESSI GRACIAS a unas GAFAS ESPECIALES 😍;SPORT;https://www.youtube.com/watch?v=-t0h8GOZCMY;2020-09-26T15:08:57Z;2020;9;8;17;Fútbol
309;h8BGfuXkVaI;2020 Tuscan Grand Prix: Qualifying Highlights;FORMULA 1;https://www.youtube.com/watch?v=h8BGfuXkVaI;2020-09-12T14:57:55Z;2020;9;9;17;Automovilismo
310;WUzdhcwT8uM;DAY 1 of Beginner EPIC | No Equipment Lower Body Workout;Caroline Girvan;https://www.youtube.com/watch?v=WUzdhcwT8uM;2020-09-21T07:30:00Z;2020;9;10;17;Fitness
311;sv2P6ZZsAKk;Fastest Wimbledon Shots Ever | Wimbledon Retro;Wimbledon;https://www.youtube.com/watch?v=sv2P6ZZsAKk;2020-09-14T07:29:10Z;2020;9;11;17;Tenis
312;XJ89PFCzAeE;The VERY Best Of Lakers 2019-20 Season;NBA;https://www.youtube.com/watch?v=XJ89PFCzAeE;2020-09-27T18:00:04Z;2020;9;12;17;Baloncesto
313;5T3Q5uo_1jo;¿Cómo aprendí a tirar de KNUCKLEBALL en 1 DÍA?;javifreestyle;https://www.youtube.com/watch?v=5T3Q5uo_1jo;2020-09-20T12:25:30Z;2020;9;13;17;Fútbol
314;39fCKTCOg8A;Upgrading and SELLING my Mountain Bike for the cause!;Berm Peak;https://www.youtube.com/watch?v=39fCKTCOg8A;2020-09-04T15:00:01Z;2020;9;14;17;Ciclismo
315;IE3BHm-78V0;Golf Pro Vs 7 Year Old SUPERSTAR....WE SWAP CLUBS;Rick Shiels Golf;https://www.youtube.com/watch?v=IE3BHm-78V0;2020-09-04T15:00:04Z;2020;9;15;17;Golf
316;N-TuSZtyqPY;TOP 10 MESSI SKILLS to Beat Defenders;AllAttack;https://www.youtube.com/watch?v=N-TuSZtyqPY;2020-10-07T15:47:15Z;2020;10;1;17;Fútbol
317;-CWPIgK4G-k;"20 MIN BOOTY + THIGHS - with weights I build your booty &amp; tone your thighs // TALKING MODE";Pamela Reif;https://www.youtube.com/watch?v=-CWPIgK4G-k;2020-10-20T04:00:00Z;2020;10;2;17;Fitness
318;PyeMyGJDCn8;"El Regreso de FIGO al Camp Nou como JUDAS 🐷 y El CLÁSICO del &#39;Cochinillo&#39; ► Barcelona vs Real Madrid";Memorias del Fútbol;https://www.youtube.com/watch?v=PyeMyGJDCn8;2020-10-25T18:13:12Z;2020;10;3;17;Fútbol
319;Xy3bLO0L464;Cardio Sin Saltos Para Perder Peso Rapido;Sientete Joven;https://www.youtube.com/watch?v=Xy3bLO0L464;2020-10-11T18:00:09Z;2020;10;4;17;Fitness
320;rXV5tFE0Srg;EJERCICIOS PARA REDUCIR CINTURA | CINTURA DE AVISPA | ALESSANDRA NADIA |;Alessandra Nadia;https://www.youtube.com/watch?v=rXV5tFE0Srg;2020-10-02T19:13:19Z;2020;10;5;17;Fitness
321;sWSO4BxJkVk;Evolution of Every NFL Team’s EVERY Stadium | NFL Explained;NFL Throwback;https://www.youtube.com/watch?v=sWSO4BxJkVk;2020-10-14T23:00:15Z;2020;10;6;17;Fútbol americano
322;CKzI2XOMF58;"Marini&#39;s monster highside | 2020 #FrenchGP";MotoGP;https://www.youtube.com/watch?v=CKzI2XOMF58;2020-10-10T08:30:43Z;2020;10;7;17;Motociclismo
323;atlVu1pYFrg;12-Year-Old Basketball PHENOM | The Next GREAT Point Guard? 👀;Whistle;https://www.youtube.com/watch?v=atlVu1pYFrg;2020-10-27T21:00:01Z;2020;10;8;17;Baloncesto
324;EE1e1dn0dJA;Khabib: Todas Sus Finalizaciones;ufcespanol;https://www.youtube.com/watch?v=EE1e1dn0dJA;2020-10-20T11:06:24Z;2020;10;9;17;Artes marciales mixtas
325;ebpUYnxOlHE;The Top Plays From The 2020 #NBAPlayoffs!;NBA;https://www.youtube.com/watch?v=ebpUYnxOlHE;2020-10-14T22:00:07Z;2020;10;10;17;Baloncesto
326;wLlq7yOPzKM;¿Quién es el MEJOR GOLEADOR que has VISTO?;El Chiringuito de Jugones;https://www.youtube.com/watch?v=wLlq7yOPzKM;2020-10-14T23:36:58Z;2020;10;11;17;Fútbol
327;cHfPkrzIKJk;EUROCOPA 2012 🇪🇸 🏆 ESPAÑA TRI-CAMPEÓN de la EURO en KIEV ⚽ Historia de la Euro;Memorias del Fútbol;https://www.youtube.com/watch?v=cHfPkrzIKJk;2020-10-05T17:15:11Z;2020;10;12;17;Fútbol
328;Nr6qlQqj2YE;FREE Golf launch monitor app for iPhone! (Is it good?);Rick Shiels Golf;https://www.youtube.com/watch?v=Nr6qlQqj2YE;2020-10-26T18:00:05Z;2020;10;13;17;Golf
329;m3LIbJ8vEVI;"The Lakers&#39; Best Plays From The 2020 #NBAPlayoffs 🏆";NBA;https://www.youtube.com/watch?v=m3LIbJ8vEVI;2020-10-13T19:00:04Z;2020;10;14;17;Baloncesto
330;QNSRSx4Gm_c;La EUROCOPA 🏆 de PORTUGAL 🇵🇹;Forza Champions;https://www.youtube.com/watch?v=QNSRSx4Gm_c;2020-10-12T18:00:03Z;2020;10;15;17;Fútbol
331;ChiLWi-mBvU;"FULL MATCH - John Cena &amp; The Rock vs. The Miz &amp; R-Truth: Survivor Series 2011";WWE;https://www.youtube.com/watch?v=ChiLWi-mBvU;2020-11-22T18:00:02Z;2020;11;1;17;Lucha libre
332;dmPRZlarppM;"FULL MATCH - Team Raw vs. Team SmackDown - Men&#39;s 5-on-5 Elimination Match: Survivor Series 2018";WWE;https://www.youtube.com/watch?v=dmPRZlarppM;2020-11-17T14:00:18Z;2020;11;2;17;Lucha libre
333;1nm8cDf3sek;FULL MATCH- NXT vs. Raw vs. SmackDown - Survivor Series Elimination Match: Survivor Series 2019;WWE;https://www.youtube.com/watch?v=1nm8cDf3sek;2020-11-22T14:00:00Z;2020;11;3;17;Lucha libre
334;ZJXN3Z-yLwY;Dirt Bikes Fails Compilation #4 ☠️ Getzen Rodeo, Hixpania, Enduroc... by Jaume Soler;Jaume Soler Movies;https://www.youtube.com/watch?v=ZJXN3Z-yLwY;2020-11-23T19:00:13Z;2020;11;4;17;Motociclismo
335;qVl6d21gN9M;FULL MATCH - Charlotte Flair vs. Alexa Bliss - Champion vs. Champion Match: Survivor Series 2017;WWE;https://www.youtube.com/watch?v=qVl6d21gN9M;2020-11-11T14:00:20Z;2020;11;5;17;Lucha libre
336;8iwKkDy4fY0;ELIMINAR PAPADA Y ADELGAZAR ROSTRO | EJERCICIOS PARA ELIMINAR LA PAPADA EN CASA | NatyGlossGym;NatyGloss Gym;https://www.youtube.com/watch?v=8iwKkDy4fY0;2020-11-30T16:46:55Z;2020;11;6;17;Fitness
337;ATypGbs98F4;"15 MIN UPPER BODY - with weights / for sexy arm, back &amp; chest muscles / Male Friendly I Pamela Reif";Pamela Reif;https://www.youtube.com/watch?v=ATypGbs98F4;2020-11-25T05:00:02Z;2020;11;7;17;Fitness
338;rV_yREiSs5w;El día que Pep Guardiola explicó porqué Messi no corre todo el partido  I MARCA;MARCA;https://www.youtube.com/watch?v=rV_yREiSs5w;2020-11-19T13:46:06Z;2020;11;8;17;Fútbol
339;AXv-Soo_6kw;EURO 2016 🏆🇵🇹 La PORTUGAL de CRISTIANO RONALDO Campeona de la EUROCOPA de Francia 🇫🇷 Historia;Memorias del Fútbol;https://www.youtube.com/watch?v=AXv-Soo_6kw;2020-11-19T18:30:09Z;2020;11;9;17;Fútbol
340;bYwM1SNTEK0;🙏✈️ La TRAGEDIA de CHAPECOENSE 🏆 CAMPEÓN Copa Sudamericana 2016;Memorias del Fútbol;https://www.youtube.com/watch?v=bYwM1SNTEK0;2020-11-25T18:30:10Z;2020;11;10;17;Fútbol
341;4UpMJPQad_k;REDUCE Cintura y ELIMINA los Rollitos de la Espalda 🔥Super Efectivo🔥 Quema 500-600 Calorías | 30 Min;Entrena con Rosa Fitness;https://www.youtube.com/watch?v=4UpMJPQad_k;2020-11-08T18:00:12Z;2020;11;11;17;Fitness
342;YbVykC9WWVk;ABDOMINALES DE PIE para APLANAR ABDOMEN y REDUCIR CINTURA en 20 MINUTOS;FIT FOR IT;https://www.youtube.com/watch?v=YbVykC9WWVk;2020-11-10T20:50:40Z;2020;11;12;17;Fitness
343;Abv7M1sgNiU;"Yoga Hüftöffner für Entspannung &amp; Beweglichkeit | Intensive Dehnung für  flexible Hüften | 25 Min.";Mady Morrison;https://www.youtube.com/watch?v=Abv7M1sgNiU;2020-11-15T06:30:00Z;2020;11;13;17;Yoga
344;Ek4ssRvkQnI;Rutina de ABDOMEN BAJO | 8 MINUTOS;gymvirtual;https://www.youtube.com/watch?v=Ek4ssRvkQnI;2020-11-02T17:00:11Z;2020;11;14;17;Fitness
345;VMPH1oHfNKY;CLASE COMPLETA de TWERK - Combinación de BRAZOS;DeportesUncomo;https://www.youtube.com/watch?v=VMPH1oHfNKY;2020-11-27T18:30:01Z;2020;11;15;17;Fitness
346;7GV8zZd23KU;"20 MIN BOOTY WORKOUT - Weights &amp; Booty Band / double the torture for a round booty I Pamela Reif";Pamela Reif;https://www.youtube.com/watch?v=7GV8zZd23KU;2020-12-30T05:00:00Z;2020;12;1;17;Fitness
347;AQQMEoli2Fg;"Dirt Bikes Fails Compilation #5 ☠️ Erzberg Rodeo, Megawatt, Bassella Race 1 &amp; more by Jaume Soler";Jaume Soler Movies;https://www.youtube.com/watch?v=AQQMEoli2Fg;2020-12-22T18:00:04Z;2020;12;2;17;Motociclismo
348;9_40kIA5mwo;ABDOMINALES DE PIE para Reducir Cintura y Aplanar Abdomen EN 10 Minutos | NatyGlossGym;NatyGloss Gym;https://www.youtube.com/watch?v=9_40kIA5mwo;2020-12-14T16:07:46Z;2020;12;3;17;Fitness
349;fSQamlph1Vs;The Champions: Seasons 1-4 in Full;B/R Football;https://www.youtube.com/watch?v=fSQamlph1Vs;2020-12-25T15:00:11Z;2020;12;4;17;Fútbol
350;dM-29hy-Qyw;Luis Suarez Handball Against Ghana | South Africa 2010 | FIFA World Cup;FIFA;https://www.youtube.com/watch?v=dM-29hy-Qyw;2020-12-29T14:00:25Z;2020;12;5;17;Fútbol
351;tzvYSMbzvoY;"FULL MATCH - Ronda Rousey &amp; Ember Moon vs. Nia Jax &amp; Tamina: Raw, Dec. 3, 2018";WWE;https://www.youtube.com/watch?v=tzvYSMbzvoY;2020-12-02T19:00:20Z;2020;12;6;17;Lucha libre
352;sSP-M8RPpBw;FULL MATCH - WWE Women’s Tag Team Championship Fatal 4-Way Match: WWE Starrcade 2019;WWE;https://www.youtube.com/watch?v=sSP-M8RPpBw;2020-12-08T15:45:04Z;2020;12;7;17;Lucha libre
353;TYWEHD11bnM;Rutina para glúteos y piernas | 13 minutos;gymvirtual;https://www.youtube.com/watch?v=TYWEHD11bnM;2020-12-23T17:00:11Z;2020;12;8;17;Fitness
354;GohgTclrnFk;Ejercicios para abdomen FUERTE | 10 minutos;gymvirtual;https://www.youtube.com/watch?v=GohgTclrnFk;2020-12-28T18:15:18Z;2020;12;9;17;Fitness
355;wFSm8-xav7w;Rutina de BRAZOS con PESO | Mancuernas;gymvirtual;https://www.youtube.com/watch?v=wFSm8-xav7w;2020-12-10T17:46:11Z;2020;12;10;17;Fitness
356;DFlQJlDz2KU;Top 10 Saves of the Decade;MotoGP;https://www.youtube.com/watch?v=DFlQJlDz2KU;2020-12-16T11:00:04Z;2020;12;11;17;Fútbol
357;pR-bCYGszww;Top 10 Crashes of the Decade;MotoGP;https://www.youtube.com/watch?v=pR-bCYGszww;2020-12-09T11:00:16Z;2020;12;12;17;Automovilismo
358;9lpDFCOPOZ0;Cardio para perder grasa, lo que debes saber;Oswal Candela;https://www.youtube.com/watch?v=9lpDFCOPOZ0;2020-12-10T18:00:02Z;2020;12;13;17;Fitness
359;y4g5rZen27c;UFC Best of 2020 Recap Show;UFC - Ultimate Fighting Championship;https://www.youtube.com/watch?v=y4g5rZen27c;2020-12-30T20:00:08Z;2020;12;14;17;Artes marciales mixtas
360;xKdMUAr6_vQ;BEST Of LeBron James Rim-Rocking DUNKS | NBA Career;NBA;https://www.youtube.com/watch?v=xKdMUAr6_vQ;2020-12-11T21:01:04Z;2020;12;15;17;Baloncesto
361;sZX4MmdXPRA;FULL MATCH - 2020 Men’s Royal Rumble Match: Royal Rumble 2020;WWE;https://www.youtube.com/watch?v=sZX4MmdXPRA;2021-01-31T14:00:29Z;2021;1;1;17;Lucha libre
362;QZ4RpUcNCl8;"FULL MATCH - Reigns &amp; Usos vs. Corbin, Ziggler &amp; Roode: SmackDown, Jan. 31, 2020";WWE;https://www.youtube.com/watch?v=QZ4RpUcNCl8;2021-01-31T18:00:15Z;2021;1;2;17;Lucha libre
363;x_OGKTJ8dDQ;FULL MATCH - 2019 Men’s Royal Rumble Match: Royal Rumble 2019;WWE;https://www.youtube.com/watch?v=x_OGKTJ8dDQ;2021-01-24T14:00:11Z;2021;1;3;17;Lucha libre
364;0luZHrRWkdY;Wrestler Goldberg tosses fan into water, goofs off at The American Express;PGA TOUR;https://www.youtube.com/watch?v=0luZHrRWkdY;2021-01-22T13:00:00Z;2021;1;4;17;Lucha libre
365;dMFuIB50H0Q;FULL MATCH - 2020 Women’s Royal Rumble Match: Royal Rumble 2020;WWE;https://www.youtube.com/watch?v=dMFuIB50H0Q;2021-01-30T21:00:07Z;2021;1;5;17;Lucha libre
366;EhfRkpllrfk;"FULL MATCH - Ronda Rousey &amp; Natalya vs. Nia Jax &amp; Tamina: Raw, Dec. 31, 2018";WWE;https://www.youtube.com/watch?v=EhfRkpllrfk;2021-01-02T21:00:01Z;2021;1;6;17;Lucha libre
367;x7ddnyNMl5s;"INSIDE STORY: Sergio Perez&#39;s Astonishing Last To First Victory";FORMULA 1;https://www.youtube.com/watch?v=x7ddnyNMl5s;2021-01-29T20:00:13Z;2021;1;7;17;Automovilismo
368;yRETGh8IF4E;"Enduro Crash &amp; Show 2020 ☠️ Dirt Bike Fails Compilation #6 by Jaume Soler";Jaume Soler Movies;https://www.youtube.com/watch?v=yRETGh8IF4E;2021-01-19T18:00:07Z;2021;1;8;17;Motocross
369;xqLjp_jig3s;FULL MATCH - Roman Reigns vs. Robert Roode – Tables Match: SmackDown, Jan. 17, 2020;WWE;https://www.youtube.com/watch?v=xqLjp_jig3s;2021-01-17T14:00:14Z;2021;1;9;17;Lucha libre
370;UUWrgpa9Ad8;FULL MATCH - 20-Man Battle Royal: Raw, Apr. 25, 2011;WWE;https://www.youtube.com/watch?v=UUWrgpa9Ad8;2021-01-12T14:00:16Z;2021;1;10;17;Lucha libre
371;ut6wwW0mhPA;FULL MATCH - Styles vs. Mysterio vs. Orton vs. Joe vs. Ali: SmackDown, Jan. 1, 2019;WWE;https://www.youtube.com/watch?v=ut6wwW0mhPA;2021-01-01T19:00:10Z;2021;1;11;17;Lucha libre
372;BOlnguSdki0;"FULL MATCH - Ronda Rousey &amp; Sasha Banks vs. Nia Jax &amp; Tamina: Raw, Jan. 14, 2019";WWE;https://www.youtube.com/watch?v=BOlnguSdki0;2021-01-14T16:00:02Z;2021;1;12;17;Lucha libre
373;7JzZZgUBAPw;Ejercicios ASIÁTICOS empezando desde Cero | Desafío 1 de 6 ✅🔥Quema GRASA Abdominal🔥✅;Entrena con Rosa Fitness;https://www.youtube.com/watch?v=7JzZZgUBAPw;2021-01-03T18:00:13Z;2021;1;13;17;Fitness
374;fIIjBLMHYvw;MARCELO VS DELANTERO09 - Retos de Fútbol;Delantero09;https://www.youtube.com/watch?v=fIIjBLMHYvw;2021-01-14T15:27:22Z;2021;1;14;17;Fútbol
375;wGYNC1LOvSA;Bianca Belair soars through Bayley’s Ultimate Athlete Obstacle Course: SmackDown, Jan. 22, 2021;WWE;https://www.youtube.com/watch?v=wGYNC1LOvSA;2021-01-23T03:50:07Z;2021;1;15;17;Lucha libre
376;SO_1AiCdTNE;Bạn có biết khi vợt cầu lông bị đứt lưới sẽ được cắt như thế nào để giữ an toàn cho vợt? #shorts;Tuấn Sport Nha Trang;https://www.youtube.com/watch?v=SO_1AiCdTNE;2021-02-20T05:37:06Z;2021;2;1;17;Bádminton
377;93dhiIP6DY0;Penalty Saves That Only Selling To Believe;iLance7i;https://www.youtube.com/watch?v=93dhiIP6DY0;2021-02-28T16:00:06Z;2021;2;2;17;Fútbol
378;F4miQNlD9MQ;🤯 LATE COMEBACK DRAMA! | HIGHLIGHTS | Granada 3-5 Barça;FC Barcelona;https://www.youtube.com/watch?v=F4miQNlD9MQ;2021-02-03T23:14:54Z;2021;2;3;17;Fútbol
379;siBt5ithlQ8;🤯 Comeback worthy of a final! | HIGHLIGHTS | Barça 3-0 Sevilla;FC Barcelona;https://www.youtube.com/watch?v=siBt5ithlQ8;2021-03-03T23:19:24Z;2021;2;4;17;Fútbol
380;1PHnDbbmHIA;INCREÍBLE Salto con pértiga FEMENINO ROUEN 2021;The best Pole Vault / Athletics ®;https://www.youtube.com/watch?v=1PHnDbbmHIA;2021-02-12T20:01:02Z;2021;2;5;17;Atletismo
381;VXtY8BrE4RA;2017 #DutchGP | Full MotoGP Race;MotoGP;https://www.youtube.com/watch?v=VXtY8BrE4RA;2021-02-10T17:20:43Z;2021;2;6;17;Motociclismo
382;ftdeWa_ytAA;"🔴🔵 La &quot;REMONTADA&quot; del BARCELONA al PSG (6-1) 😲 Champions League 2017";Memorias del Fútbol;https://www.youtube.com/watch?v=ftdeWa_ytAA;2021-02-04T18:30:09Z;2021;2;7;17;Fútbol
383;ijOpjTspoA0;Expect More Better With SIM2 Irons | TaylorMade Golf;TaylorMade Golf;https://www.youtube.com/watch?v=ijOpjTspoA0;2021-02-09T17:00:13Z;2021;2;8;17;Golf
384;JS5LxHLmv8Q;¿LUIS SUÁREZ o CRISTIANO? | La respuesta de PIQUÉ a DjMaRiiO;POST UNITED;https://www.youtube.com/watch?v=JS5LxHLmv8Q;2021-02-20T17:00:10Z;2021;2;9;17;Fútbol
385;vQwf29kDDk0;ASÍ FUE EL ENFADO DE TER STEGEN CON UN RECOGEPELOTAS durante el SEVILLA - BARÇA DE COPA 💥;SPORT;https://www.youtube.com/watch?v=vQwf29kDDk0;2021-02-11T18:30:12Z;2021;2;10;17;Fútbol
386;S96t-YfYg5Q;(#1) ABDOMEN PLANO en 20 MINUTOS DIARIOS - Marcar Abdomen en CASA o GYM - Vientre Plano;Europa Sport Nutrition;https://www.youtube.com/watch?v=S96t-YfYg5Q;2021-02-18T17:00:10Z;2021;2;11;17;Fitness
387;0YPSmod_v3I;FC BARCELONA Campeón CHAMPIONS LEAGUE 2011 🏆⚽ El Climax del Tiki Taka;Memorias del Fútbol;https://www.youtube.com/watch?v=0YPSmod_v3I;2021-02-28T18:00:13Z;2021;2;12;17;Fútbol
388;STypt0Idtvw;Glúteos, abdomen y piernas | Rutina GAP 15 Minutos;gymvirtual;https://www.youtube.com/watch?v=STypt0Idtvw;2021-02-22T18:43:47Z;2021;2;13;17;Fitness
389;V-Lz4QpzwKk;▷ El SEXTETE del BAYERN Munich (2020) 🏆🏆🏆🏆🏆🏆 La PELÍCULA;Memorias del Fútbol;https://www.youtube.com/watch?v=V-Lz4QpzwKk;2021-02-14T18:00:13Z;2021;2;14;17;Fútbol
390;7fvpPyxVluU;⚽ 50 BALONES ⚽ Épic Retos de Fútbol;DoctorePoLLo;https://www.youtube.com/watch?v=7fvpPyxVluU;2021-02-15T16:15:00Z;2021;2;15;17;Fútbol
391;BBhOLRT0K7o;Live More Now | BUFF®;BUFF®;https://www.youtube.com/watch?v=BBhOLRT0K7o;2021-03-19T13:27:23Z;2021;3;1;17;Deportes varios
392;6Nvbe_gvsIA;"Cómo tirar la negra &quot;imposible&quot; | The Billartist";The Billartist;https://www.youtube.com/watch?v=6Nvbe_gvsIA;2021-03-28T19:13:50Z;2021;3;2;17;Billar
393;vtD5nGoNMu8;10 MIN BUBBLE BUTT - Glute Bridge Burnout / no squats, no jumps, knee-friendly I with Equipment;Pamela Reif;https://www.youtube.com/watch?v=vtD5nGoNMu8;2021-03-23T04:30:06Z;2021;3;3;17;Fitness
394;siBt5ithlQ8;🤯 Comeback worthy of a final! | HIGHLIGHTS | Barça 3-0 Sevilla;FC Barcelona;https://www.youtube.com/watch?v=siBt5ithlQ8;2021-03-03T23:19:24Z;2021;3;4;17;Fútbol
395;PDaa5tj5sWs;Real Madrid vs FC Barcelona (0-4) J12 2015/2016 - FULL MATCH;LaLiga Santander;https://www.youtube.com/watch?v=PDaa5tj5sWs;2021-03-31T10:00:16Z;2021;3;5;17;Fútbol
396;xzehnfQTM94;LAMINE YAMAL DEL BARÇA SERÁ UN CRACK DEL FÚTBOL MUNDIAL!;Reykob 7.0;https://www.youtube.com/watch?v=xzehnfQTM94;2021-03-15T20:45:11Z;2021;3;6;17;Fútbol
397;5zp7MKXmA_s;Eiskunstläufer Yuzuru Hanyu mit dem Auftritt seines Lebens | Sportschau;Sportschau;https://www.youtube.com/watch?v=5zp7MKXmA_s;2021-03-30T08:35:08Z;2021;3;7;17;Patinaje artístico
398;jsOS9V0vW8s;🚫 ASI TE ENGAÑÓ RONALDINHO Y NO TE DISTE CUENTA;javifreestyle;https://www.youtube.com/watch?v=jsOS9V0vW8s;2021-03-27T14:15:39Z;2021;3;8;17;Fútbol
399;6EsGpXh5jcg;Mario Roman 🏆 | Spanish Hard Enduro Round 2 | La Rioja;Mario Roman;https://www.youtube.com/watch?v=6EsGpXh5jcg;2021-03-16T13:29:32Z;2021;3;9;17;Motociclismo
400;vtnuy1Vrfsg;The Ultimate Guide To The 2021 F1 Season;FORMULA 1;https://www.youtube.com/watch?v=vtnuy1Vrfsg;2021-03-21T15:00:14Z;2021;3;10;17;Automovilismo
401;bvTPxCOfjdE;Why Steph Curry might be the best offensive player ever | Greatest Peaks Ep. 15;Thinking Basketball;https://www.youtube.com/watch?v=bvTPxCOfjdE;2021-03-15T21:15:01Z;2021;3;11;17;Baloncesto
402;14cbn3RvPzw;💙 La 1ª CHAMPIONS LEAGUE del CHELSEA (2012)🏆 ¿Suerte o Épica?;Memorias del Fútbol;https://www.youtube.com/watch?v=14cbn3RvPzw;2021-03-15T18:45:13Z;2021;3;12;17;Fútbol
403;BgnMW7qhJU0;UFC 260: Live Weigh-in Show;UFC - Ultimate Fighting Championship;https://www.youtube.com/watch?v=BgnMW7qhJU0;2021-03-26T18:43:36Z;2021;3;13;17;Artes marciales mixtas
404;ZDgM3BN4I5U;"The True Story Behind Max Verstappen&#39;s First F1 Win";Red Bull;https://www.youtube.com/watch?v=ZDgM3BN4I5U;2021-03-24T13:00:11Z;2021;3;14;17;Automovilismo
405;z0eulElSJK0;15 Minute BURNING Biceps Workout / Dumbbells - Caroline Girvan;Caroline Girvan;https://www.youtube.com/watch?v=z0eulElSJK0;2021-03-31T04:00:11Z;2021;3;15;17;Fitness
406;KXe3iSTgNUs;How to start your Kitesurfing session right;Kitesurfing Official;https://www.youtube.com/watch?v=KXe3iSTgNUs;2021-04-13T14:26:25Z;2021;4;1;17;Kitesurf
407;ubTuAl2xZFE;Pegatinas en la bicicleta. Como poner un dorsal y poder conservarlo después. #shorts;josemaria_lpz;https://www.youtube.com/watch?v=ubTuAl2xZFE;2021-04-23T17:22:12Z;2021;4;2;17;Ciclismo
408;cXBfVPp1DJU;Real Madrid vs FC Barcelona (2-3) J33 2016/2017 - FULL MATCH;LaLiga Santander;https://www.youtube.com/watch?v=cXBfVPp1DJU;2021-04-06T10:00:12Z;2021;4;3;17;Fútbol
409;zYpUs22wAL4;🏆 HIGHLIGHTS ATHLETIC 0-4 BARÇA COPA DEL REY 2021 FINAL CHAMPIONS! 🏆 #CopaBarça;FC Barcelona;https://www.youtube.com/watch?v=zYpUs22wAL4;2021-04-17T22:25:47Z;2021;4;4;17;Fútbol
410;U_ECD9roYXk;FC Barcelona vs Real Madrid (1-2) J31 2015/2016 - FULL MATCH;LaLiga Santander;https://www.youtube.com/watch?v=U_ECD9roYXk;2021-04-01T10:00:25Z;2021;4;5;17;Fútbol
411;OuwINIG3oWk;FC Barcelona vs Real Madrid (1-1) J14 2016/2017 - FULL MATCH;LaLiga Santander;https://www.youtube.com/watch?v=OuwINIG3oWk;2021-04-02T10:00:24Z;2021;4;6;17;Fútbol
412;vLduDUYoEik;The Champions: Season 5, Episode 1;B/R Football;https://www.youtube.com/watch?v=vLduDUYoEik;2021-04-26T21:00:31Z;2021;4;7;17;Fútbol
413;b-Cy0G7SNy4;"Modric a Piqué: &quot;Ahora a rajar, ¿eh?&quot;";GOL PLAY;https://www.youtube.com/watch?v=b-Cy0G7SNy4;2021-04-11T16:53:29Z;2021;4;8;17;Fútbol
414;YfOSZJRknW8;"Carles Puyol - Respect moments &amp; defending skills";FCB GLORY;https://www.youtube.com/watch?v=YfOSZJRknW8;2021-04-25T17:27:11Z;2021;4;9;17;Fútbol
415;tGTLxIC66WE;You NEED to learn these golf shots!;Rick Shiels Golf;https://www.youtube.com/watch?v=tGTLxIC66WE;2021-04-29T16:00:22Z;2021;4;10;17;Golf
416;YEz_fvbPYgQ;⚽ BALÓN de 50 AÑOS vs BALÓN MODERNO ⚽ ¡Retos de Fútbol!;DoctorePoLLo;https://www.youtube.com/watch?v=YEz_fvbPYgQ;2021-04-21T15:15:01Z;2021;4;11;17;Fútbol
417;kPl66RocFDo;30-Minute At-Home Strength Training Workout | BODYPUMP | LES MILLS X REEBOK NANO SERIES;Les Mills;https://www.youtube.com/watch?v=kPl66RocFDo;2021-04-29T19:30:08Z;2021;4;12;17;Fitness
418;8sPO4q01bQc;What Happened to EVERY #1 Overall Pick Since 2000?;NFL Throwback;https://www.youtube.com/watch?v=8sPO4q01bQc;2021-04-28T23:00:01Z;2021;4;13;17;Fútbol americano
419;j6fTfI375LQ;La DÉCIMA del REAL MADRID 🔟 CAMPEÓN Champions League (2014) 🏆🏆🏆🏆🏆🏆🏆🏆🏆🏆;Memorias del Fútbol;https://www.youtube.com/watch?v=j6fTfI375LQ;2021-04-26T17:45:14Z;2021;4;14;17;Fútbol
420;gP6NAQgvtNU;Daniel Bryan vs. Roman Reigns: Universal Title Match: SmackDown, April 30, 2021;WWE;https://www.youtube.com/watch?v=gP6NAQgvtNU;2021-05-01T02:47:57Z;2021;4;15;17;Lucha libre
421;AEBuFsNpY70;Xu Xin 🎩;Club Tennis Taula Calella;https://www.youtube.com/watch?v=AEBuFsNpY70;2021-05-28T09:24:25Z;2021;5;1;17;Tenis de mesa
422;vkpOuA_8DqY;Elephant Gun FAIL #Shorts;Lunkers TV;https://www.youtube.com/watch?v=vkpOuA_8DqY;2021-05-09T18:00:26Z;2021;5;2;17;Caza
423;MR-E6J91beA;Caídas tontas en bicicleta. Nunca pedalear en una curva pronunciada o nos iremos al suelo. #shorts;josemaria_lpz;https://www.youtube.com/watch?v=MR-E6J91beA;2021-05-10T15:56:40Z;2021;5;3;17;Ciclismo
424;ZalOz1sBt_o;Guantes de ciclista Castelli Rosso Corsa.A veces la comodidad pasa desapercibida. #shorts;josemaria_lpz;https://www.youtube.com/watch?v=ZalOz1sBt_o;2021-05-14T18:15:19Z;2021;5;4;17;Ciclismo
425;lyn6AHXjcBQ;FC BARCELONA Campeón CHAMPIONS LEAGUE (2015) 🏆 El Triplete de la MSN y Luis Enrique ❤️💙;Memorias del Fútbol;https://www.youtube.com/watch?v=lyn6AHXjcBQ;2021-05-25T18:00:12Z;2021;5;5;17;Fútbol
426;N6bbkSiZ0Xk;Table Tennis Best Point Ever 💥;Club Tennis Taula Calella;https://www.youtube.com/watch?v=N6bbkSiZ0Xk;2021-05-28T13:58:16Z;2021;5;6;17;Tenis de mesa
427;OdBLKBE1DdY;The Champions: Season 5 In Full;B/R Football;https://www.youtube.com/watch?v=OdBLKBE1DdY;2021-05-31T22:00:07Z;2021;5;7;17;Fútbol
428;3lpnfj08TgU;LEICESTER CITY 🦊 Campeón PREMIER LEAGUE (2015-2016) 🏆 Una Historia de Película [HD];Memorias del Fútbol;https://www.youtube.com/watch?v=3lpnfj08TgU;2021-05-10T17:45:13Z;2021;5;8;17;Fútbol
429;7bjpguXESI8;"INSIDE STORY: Mercedes&#39; Strategic Masterclass | 2021 Spanish Grand Prix";FORMULA 1;https://www.youtube.com/watch?v=7bjpguXESI8;2021-05-30T21:12:11Z;2021;5;9;17;Automovilismo
430;eh0z_f0E6lw;NEYMAR JR ME RETA A UN PARTIDO DE FUTBOL CONTRA SUS AMIGOS;javifreestyle;https://www.youtube.com/watch?v=eh0z_f0E6lw;2021-05-22T13:21:13Z;2021;5;10;17;Fútbol
431;O5WgT3jtUCI;The Champions: Season 5, Episode 3;B/R Football;https://www.youtube.com/watch?v=O5WgT3jtUCI;2021-05-10T21:00:14Z;2021;5;11;17;Fútbol
432;TGsxAqjIxlE;"LaMelo&#39;s BEST PLAYS From The 2020-21 Season! 🏀";NBA;https://www.youtube.com/watch?v=TGsxAqjIxlE;2021-05-18T20:00:03Z;2021;5;12;17;Baloncesto
433;yjGp2U19x38;DEJA DE GOLPEAR PAREDES. Métodos EFECTIVOS de ENDURECIMIENTO DE NUDILLOS | Alberto Barberá;Alberto Barberá;https://www.youtube.com/watch?v=yjGp2U19x38;2021-05-04T21:17:10Z;2021;5;13;17;Artes marciales mixtas
434;FoSbkW3A3Uc;DAVID ALABA | New Real Madrid player!;Real Madrid;https://www.youtube.com/watch?v=FoSbkW3A3Uc;2021-05-28T16:56:03Z;2021;5;14;17;Fútbol
435;WD6kFOpJasQ;"Neymar Jr ● Parado No Bailão ● Amazing Goals &amp; Skills 2021 | HD";GoDZillaXx;https://www.youtube.com/watch?v=WD6kFOpJasQ;2021-05-01T14:14:51Z;2021;5;15;17;Fútbol
436;lLVoNZDh5jg;Pegotón de BARRO en la carretera. Peligros. #shorts;josemaria_lpz;https://www.youtube.com/watch?v=lLVoNZDh5jg;2021-06-05T14:05:09Z;2021;6;1;17;Ciclismo
