n;id;titulo;canal;enlace;fecha;anyo;mes;posicion;cat;deporte
1;NncmQk5a9Dg;ADELGAZAR RÁPIDO | Cardio para perder peso;gymvirtual;https://www.youtube.com/watch?v=NncmQk5a9Dg;2019-01-28T17:00:04Z;2019;1;1;17;Fitness
2;KLIa2UaE2KE;"Italy vs Brazil – Men&#39;s Volleyball Gold Medal Match at Rio 2016 | Throwback Thursday";Olympics;https://www.youtube.com/watch?v=KLIa2UaE2KE;2019-01-10T13:01:12Z;2019;1;2;17;Voleibol
3;bGWo1KECm3E;La Leyenda de PELÉ, Así jugaba el Rey del Fútbol 🤴🏿 🇧🇷 (1940-2022) DEP;Memorias del Fútbol;https://www.youtube.com/watch?v=bGWo1KECm3E;2019-01-23T17:58:45Z;2019;1;3;17;Fútbol
4;VYSTaVBpwPg;Top 10 Moments of Schumacher Brilliance;FORMULA 1;https://www.youtube.com/watch?v=VYSTaVBpwPg;2019-01-04T13:19:12Z;2019;1;4;17;Automovilismo
5;pJGNEapGmqo;Adelgazar brazos y espalda rapidamente | Eliminar grasa de las axilas;gymvirtual;https://www.youtube.com/watch?v=pJGNEapGmqo;2019-01-21T17:00:05Z;2019;1;5;17;Fitness
6;wAYF_4OSiAs;Rutina Para Tonificar Todo El Cuerpo Y Quemar Grasa 🔥;Sientete Joven;https://www.youtube.com/watch?v=wAYF_4OSiAs;2019-01-27T18:45:01Z;2019;1;6;17;Fitness
7;SRanmNL7UOU;FINAL Media Gol Cup (Alevín): FC Barcelona - Real Madrid (2-2, 5-4);FC Barcelona;https://www.youtube.com/watch?v=SRanmNL7UOU;2019-01-01T16:17:43Z;2019;1;7;17;Fútbol
8;VDV2qe7uUMo;"Scottie Pippen reacts to LeBron calling himself GOAT: &#39;You can&#39;t say you&#39;re the greatest&#39; | The Jump";ESPN;https://www.youtube.com/watch?v=VDV2qe7uUMo;2019-01-04T22:30:01Z;2019;1;8;17;Baloncesto
9;Q2TTLUxlNu4;Reto 100 sentadillas | Piernas y glúteos tonificados;gymvirtual;https://www.youtube.com/watch?v=Q2TTLUxlNu4;2019-01-02T17:00:01Z;2019;1;9;17;Fitness
10;EGSbzzJeEgg;Reto 200 sentadillas para tonificar las piernas y glúteos;gymvirtual;https://www.youtube.com/watch?v=EGSbzzJeEgg;2019-01-10T16:58:12Z;2019;1;10;17;Fitness
11;X0VhRGH6XQc;Rutina Cardio Todo el Cuerpo 50 minutos Quema Grasa Cardio Full Body para principiantes;Sientete Joven;https://www.youtube.com/watch?v=X0VhRGH6XQc;2019-01-13T18:45:01Z;2019;1;11;17;Fitness
12;keMxEgwBxtE;CARDIO BAJO IMPACTO PARA ADELGAZAR | Ejercicios sin saltos;gymvirtual;https://www.youtube.com/watch?v=keMxEgwBxtE;2019-01-14T17:37:16Z;2019;1;12;17;Fitness
13;B20JSjVP80M;REPLAY: 2019 Honda NHL All-Star Game;NHL;https://www.youtube.com/watch?v=B20JSjVP80M;2019-01-27T21:24:37Z;2019;1;13;17;Hockey sobre hielo
14;U06IQTmh2Bg;TOP 25 GOALS Lionel Messi en LaLiga Santander;LaLiga Santander;https://www.youtube.com/watch?v=U06IQTmh2Bg;2019-01-13T20:32:04Z;2019;1;14;17;Fútbol
15;C-szjYgNi2g;"Scottie Pippen reveals Michael Jordan&#39;s most unguardable move | The Jump: OT";ESPN;https://www.youtube.com/watch?v=C-szjYgNi2g;2019-01-25T23:50:08Z;2019;1;15;17;Baloncesto
16;s6Jazu4oXls;"Yoga Morgenroutine für Anfänger | Den ganzen Körper Dehnen &amp; Mobilisieren | 10 Minuten";Mady Morrison;https://www.youtube.com/watch?v=s6Jazu4oXls;2019-02-17T07:00:04Z;2019;2;1;17;Yoga
17;ue1NT3QhuVU;Top 10 Dunks of The Decade;NBA;https://www.youtube.com/watch?v=ue1NT3QhuVU;2019-02-16T00:07:01Z;2019;2;2;17;Baloncesto
18;pWoj6Mlit2k;NIÑO DE 7 AÑOS ME RETA 1VS1 JUGANDO AL FÚTBOL ft. William Cvek;Delantero09;https://www.youtube.com/watch?v=pWoj6Mlit2k;2019-02-03T18:35:35Z;2019;2;3;17;Fútbol
19;OrH7JHHn_q4;TEAM LEBRON vs TEAM GIANNIS | 2019 NBA All-Star Game | February 17, 2019;NBA;https://www.youtube.com/watch?v=OrH7JHHn_q4;2019-02-18T04:10:35Z;2019;2;4;17;Baloncesto
20;cZ4kIVL0Cgo;Weirdest NBA Moments of 2018/2019 - Part 1;NBA Max;https://www.youtube.com/watch?v=cZ4kIVL0Cgo;2019-02-27T21:12:20Z;2019;2;5;17;Baloncesto
21;CVLh9oVZ1Sw;"Paulo Dybala ● Con Calma - Daddy Yankee ● Goals &amp; Skills | 2018/19 | HD";GoDZillaXx;https://www.youtube.com/watch?v=CVLh9oVZ1Sw;2019-03-01T16:53:56Z;2019;2;6;17;Fútbol
22;_hnl3Bw--eQ;"Best Of Stephen Curry&#39;s Career Dunks";NBA;https://www.youtube.com/watch?v=_hnl3Bw--eQ;2019-02-23T14:00:02Z;2019;2;7;17;Baloncesto
23;pvFiep6BOT4;"LIONEL MESSI JUGGLING CHALLENGE | testing Messi&#39;s skills";Unisport;https://www.youtube.com/watch?v=pvFiep6BOT4;2019-03-03T17:22:05Z;2019;2;8;17;Fútbol
24;QQkpHI9qv0A;Rutina HIIT para adelgazar 15 minutos en Casa - HIIT Quema Grasa;Myprotein España;https://www.youtube.com/watch?v=QQkpHI9qv0A;2019-02-24T18:30:00Z;2019;2;9;17;Fitness
25;3h6aR4OlVJk;300 Abdominales de pie | Ejercicios para abdomen fuerte;gymvirtual;https://www.youtube.com/watch?v=3h6aR4OlVJk;2019-02-04T17:13:41Z;2019;2;10;17;Fitness
26;OhdzCSooj2o;KARIM BENZEMA VS DELANTERO09 - Retos de Fútbol;Delantero09;https://www.youtube.com/watch?v=OhdzCSooj2o;2019-02-21T18:35:01Z;2019;2;11;17;Fútbol
27;a0QXPoVzxmM;11 Super Cheap MTB Upgrades;Berm Peak;https://www.youtube.com/watch?v=a0QXPoVzxmM;2019-02-21T17:55:55Z;2019;2;12;17;Ciclismo de montaña
28;kqnB76cQSd0;Check out the best of the 2019 WKC Masters Agility Championship | FOX SPORTS;FOX Sports;https://www.youtube.com/watch?v=kqnB76cQSd0;2019-02-11T00:41:45Z;2019;2;13;17;Agility para perros
29;hxMsVbFr1Bc;P!nk the border collie wins back-to-back titles at the 2019 WKC Masters Agility | FOX SPORTS;FOX Sports;https://www.youtube.com/watch?v=hxMsVbFr1Bc;2019-02-10T22:09:51Z;2019;2;14;17;Agility para perros
30;EC9VLIaub3Q;Rutina Cardio Todo el Cuerpo 30 minutos Quema Grasa Cardio Full Body para principiantes;Sientete Joven;https://www.youtube.com/watch?v=EC9VLIaub3Q;2019-02-03T18:45:00Z;2019;2;15;17;Fitness
31;5tUiCgt6hoU;Lionel Messi Destroying Sergio Ramos ● The Ultimate Video ► 2005-2019;Messi TheBoss;https://www.youtube.com/watch?v=5tUiCgt6hoU;2019-03-07T13:22:40Z;2019;3;1;17;Fútbol
32;a-ogSQBi5Eo;Crazy Reactions on Legendary Messi Goals | HD;Messi TheBoss;https://www.youtube.com/watch?v=a-ogSQBi5Eo;2019-03-22T18:28:28Z;2019;3;2;17;Fútbol
33;b9jAtxH903Q;Ronda Rousey vs. Sarah Logan - Beat the Clock Challenge Match: Raw, March 25, 2019;WWE;https://www.youtube.com/watch?v=b9jAtxH903Q;2019-03-26T00:57:16Z;2019;3;3;17;Lucha libre
34;bveTl0LKS2s;El Día Después (04/03/2019): Real Madrid vs FC Barcelona: algo más que fútbol;El Día Después por Movistar Plus+;https://www.youtube.com/watch?v=bveTl0LKS2s;2019-03-04T22:26:39Z;2019;3;4;17;Fútbol
35;kn5uevla61U;"Brazil vs Germany - FULL Match - Men&#39;s Football Final Rio 2016 | Throwback Thursday";Olympics;https://www.youtube.com/watch?v=kn5uevla61U;2019-03-21T12:00:08Z;2019;3;5;17;Fútbol
36;0sKN7yYC42g;The golf ball that made golfers too good;Vox;https://www.youtube.com/watch?v=0sKN7yYC42g;2019-03-15T12:00:12Z;2019;3;6;17;Golf
37;CVLh9oVZ1Sw;"Paulo Dybala ● Con Calma - Daddy Yankee ● Goals &amp; Skills | 2018/19 | HD";GoDZillaXx;https://www.youtube.com/watch?v=CVLh9oVZ1Sw;2019-03-01T16:53:56Z;2019;3;7;17;Fútbol
38;o86YFuGPTNA;Abdominales De Pie - 15 Minutos Para Reducir Cintura;Sientete Joven;https://www.youtube.com/watch?v=o86YFuGPTNA;2019-03-10T18:45:00Z;2019;3;8;17;Fitness
39;pvFiep6BOT4;"LIONEL MESSI JUGGLING CHALLENGE | testing Messi&#39;s skills";Unisport;https://www.youtube.com/watch?v=pvFiep6BOT4;2019-03-03T17:22:05Z;2019;3;9;17;Fútbol
40;NdD8gEGj0to;2019 Australian Grand Prix: Race Highlights;FORMULA 1;https://www.youtube.com/watch?v=NdD8gEGj0to;2019-03-17T08:54:46Z;2019;3;10;17;Automovilismo
41;gCwAWbJWbMA;Glúteos en 8 minutos | Glúteos grandes con ejercicios intensos en casa;gymvirtual;https://www.youtube.com/watch?v=gCwAWbJWbMA;2019-03-18T16:58:44Z;2019;3;11;17;Fitness
42;jwdAPlpKwSw;Rutina de estiramientos para crecer unos centímetros | Mejorar la postura de la espalda;gymvirtual;https://www.youtube.com/watch?v=jwdAPlpKwSw;2019-03-06T16:58:44Z;2019;3;12;17;Fitness
43;10xVoPIfYOU;Rutina de ejercicios para glúteos 10 minutos | Glúteos bonitos y grandes;gymvirtual;https://www.youtube.com/watch?v=10xVoPIfYOU;2019-03-11T16:58:17Z;2019;3;13;17;Fitness
44;FVKOfa0456Y;Edson Barboza Top 5 Finishes;UFC - Ultimate Fighting Championship;https://www.youtube.com/watch?v=FVKOfa0456Y;2019-03-28T00:05:42Z;2019;3;14;17;Artes marciales mixtas
45;h4m68r8kWAc;FC BARCELONA 6-1 PSG | Match highlights;FC Barcelona;https://www.youtube.com/watch?v=h4m68r8kWAc;2019-03-08T10:11:40Z;2019;3;15;17;Fútbol
46;lKYLeII8hMo;"7 SECOND CHALLENGE BARÇA-LIVERPOOL | Luis Suárez &amp; Coutinho";FC Barcelona;https://www.youtube.com/watch?v=lKYLeII8hMo;2019-04-30T09:10:28Z;2019;4;1;17;Fútbol
47;NvDmhLH32Ig;Tonificar brazos y eliminar grasa de las axilas | GymVirtual;gymvirtual;https://www.youtube.com/watch?v=NvDmhLH32Ig;2019-04-10T15:58:13Z;2019;4;2;17;Fitness
48;8eE9bofwhhs;2019 Azerbaijan Grand Prix​: Race Highlights;FORMULA 1;https://www.youtube.com/watch?v=8eE9bofwhhs;2019-04-28T15:28:33Z;2019;4;3;17;Automovilismo
49;u7hn69ybzxU;World Record Three Point Shooter vs. Kenny ‘The Jet’ Smith!;House of Highlights;https://www.youtube.com/watch?v=u7hn69ybzxU;2019-04-28T16:30:31Z;2019;4;4;17;Baloncesto
50;CSqpCvdc520;FC. Barcelona vs Real Madrid (2011/2012) | Partido Completo;Edu Sierra;https://www.youtube.com/watch?v=CSqpCvdc520;2019-04-13T21:38:25Z;2019;4;5;17;Fútbol
51;mZj5bpB4I5M;The Quarterfinal Reel | 2019 WDSF World Open Latin Pieve di Cento;DanceSportTotal;https://www.youtube.com/watch?v=mZj5bpB4I5M;2019-04-03T11:00:05Z;2019;4;6;17;Baile deportivo
52;-pItzcHBHt0;Top 10 Moments of Ayrton Senna Brilliance;FORMULA 1;https://www.youtube.com/watch?v=-pItzcHBHt0;2019-05-01T13:30:00Z;2019;4;7;17;Automovilismo
53;eOMqaQFFhk0;BAYERN 1-1p CHELSEA: #UCL 2012 FINAL FLASHBACK;UEFA;https://www.youtube.com/watch?v=eOMqaQFFhk0;2019-04-28T07:57:46Z;2019;4;8;17;Fútbol
54;j9ihJMqZGD0;"Messi&#39;s first official goal for FC Barcelona";FC Barcelona;https://www.youtube.com/watch?v=j9ihJMqZGD0;2019-05-01T08:10:41Z;2019;4;9;17;Fútbol
55;qzPENaw5GJw;"Kyrie Irving&#39;s Best Crossover vs Every NBA Team";NBA;https://www.youtube.com/watch?v=qzPENaw5GJw;2019-04-05T17:00:06Z;2019;4;10;17;Baloncesto
56;CfaNOidukHY;Best Plays of the 2019 NBA Playoffs | First Round;NBA;https://www.youtube.com/watch?v=CfaNOidukHY;2019-04-28T13:00:03Z;2019;4;11;17;Baloncesto
57;wo5lanHnhAo;Ronaldo Realizes He’s Getting Older | The Champions S2E1;Bleacher Report;https://www.youtube.com/watch?v=wo5lanHnhAo;2019-04-29T21:00:08Z;2019;4;12;17;Fútbol
58;O5UbKfH8PlY;"Kyrie Irving&#39;s Best Plays From the 2018-19 NBA Regular Season";NBA;https://www.youtube.com/watch?v=O5UbKfH8PlY;2019-04-12T16:00:06Z;2019;4;13;17;Baloncesto
59;FpODEMhiDJA;MASAJE RELAJANTE de ESPALDA - Masaje de espalda;DeportesUncomo;https://www.youtube.com/watch?v=FpODEMhiDJA;2019-04-24T17:30:01Z;2019;4;14;17;Masaje
60;7RKmj5Sgz_E;TOP 25 GOALS Alexis Sánchez en LaLiga Santander;LaLiga Santander;https://www.youtube.com/watch?v=7RKmj5Sgz_E;2019-04-16T08:00:01Z;2019;4;15;17;Fútbol
61;WNz9C_vyIB0;Cardio Sin Saltos Para Perder Peso Rapido;Sientete Joven;https://www.youtube.com/watch?v=WNz9C_vyIB0;2019-05-26T17:45:01Z;2019;5;1;17;Fitness
62;5SubD5Kq2v4;6 Simple Exercises to Get Bigger Arms In No Time;BRIGHT SIDE;https://www.youtube.com/watch?v=5SubD5Kq2v4;2019-05-10T11:00:00Z;2019;5;2;17;Fitness
63;c96FlEr1V20;Anderson Silva Top 5 Finishes;UFC - Ultimate Fighting Championship;https://www.youtube.com/watch?v=c96FlEr1V20;2019-05-09T00:35:18Z;2019;5;3;17;Artes marciales mixtas
64;mEcTv_omtPY;CARDIO 30 MINUTOS PARA ADELGAZAR RÁPIDO | QUEMA GRASA;gymvirtual;https://www.youtube.com/watch?v=mEcTv_omtPY;2019-05-06T16:13:42Z;2019;5;4;17;Fitness
65;VMAk1_bcv90;Preakness Stakes 2019 (FULL RACE), jockey John Velazquez thrown from horse | NBC Sports;NBC Sports;https://www.youtube.com/watch?v=VMAk1_bcv90;2019-05-18T23:46:36Z;2019;5;5;17;Carreras de caballos
66;1MAgNP3IBlY;10 Exercises to Tone Your Thighs in 10 Minutes a Day;BRIGHT SIDE;https://www.youtube.com/watch?v=1MAgNP3IBlY;2019-05-13T16:10:14Z;2019;5;6;17;Fitness
67;vd1j1nqHhuY;Hatha Yoga para principiantes;Xuan Lan Yoga;https://www.youtube.com/watch?v=vd1j1nqHhuY;2019-05-23T17:45:02Z;2019;5;7;17;Yoga
68;HCVYolhSPBY;EL MAYOR ENFADO DE LA HISTORIA DE CRISTÓBAL SORIA;El Chiringuito de Jugones;https://www.youtube.com/watch?v=HCVYolhSPBY;2019-05-08T00:43:55Z;2019;5;8;17;Fútbol
69;CROx4XvLJTk;Kawhi Leonard Sends Philadelphia 76ers Home With Epic Buzzer-Beater in Game 7;Bleacher Report;https://www.youtube.com/watch?v=CROx4XvLJTk;2019-05-13T01:47:48Z;2019;5;9;17;Baloncesto
70;SQBca2ifq_Q;The Champions: Season 2 in Full;B/R Football;https://www.youtube.com/watch?v=SQBca2ifq_Q;2019-05-30T16:42:46Z;2019;5;10;17;Fútbol
71;-pItzcHBHt0;Top 10 Moments of Ayrton Senna Brilliance;FORMULA 1;https://www.youtube.com/watch?v=-pItzcHBHt0;2019-05-01T13:30:00Z;2019;5;11;17;Automovilismo
72;MUjmUeYHeFo;PUERTO VALLARTA 2019 URBAN DOWNHILL VLOG - Bienvenido Aguado;Bienvenido Aguado - HAPPYRIDINGS;https://www.youtube.com/watch?v=MUjmUeYHeFo;2019-05-26T12:35:08Z;2019;5;12;17;Ciclismo
73;xsWaxYlCbac;2019 Spanish Grand Prix: Race Highlights;FORMULA 1;https://www.youtube.com/watch?v=xsWaxYlCbac;2019-05-12T17:37:07Z;2019;5;13;17;Automovilismo
74;j9ihJMqZGD0;"Messi&#39;s first official goal for FC Barcelona";FC Barcelona;https://www.youtube.com/watch?v=j9ihJMqZGD0;2019-05-01T08:10:41Z;2019;5;14;17;Fútbol
75;q7U8ThBCAss;Todos los CAMPEONES de los MUNDIALES 🏆⚽🌟;Forza Champions;https://www.youtube.com/watch?v=q7U8ThBCAss;2019-05-06T17:00:10Z;2019;5;15;17;Fútbol
76;-HDzxuSddJw;8 Simple Exercise to Lose Love Handles Without Gym;BRIGHT SIDE;https://www.youtube.com/watch?v=-HDzxuSddJw;2019-06-03T03:00:00Z;2019;6;1;17;Fitness
77;wL87zJ6wgxw;Rutina para aumentar y tener unos glúteos grandes y bonitos;gymvirtual;https://www.youtube.com/watch?v=wL87zJ6wgxw;2019-06-27T16:00:08Z;2019;6;2;17;Fitness
78;L8taGwfp2sU;15 BEST Skill Moves to Beat Defenders in REAL GAMES;AllAttack;https://www.youtube.com/watch?v=L8taGwfp2sU;2019-06-29T16:07:06Z;2019;6;3;17;Fútbol
79;Pvxj-1dgVk0;Rutina intensa de abdomen para un vientre plano | 8 minutos;gymvirtual;https://www.youtube.com/watch?v=Pvxj-1dgVk0;2019-06-24T16:00:04Z;2019;6;4;17;Fitness
80;8ar1bMAGfoY;Penalty Real Madrid vs Atletico Madrid LaLiga Promises 2019;SACA FÚTBOL;https://www.youtube.com/watch?v=8ar1bMAGfoY;2019-06-28T09:44:47Z;2019;6;5;17;Fútbol
81;jLqyRdwDzBQ;Francis Ngannou Top 5 Finishes;UFC - Ultimate Fighting Championship;https://www.youtube.com/watch?v=jLqyRdwDzBQ;2019-06-25T17:19:28Z;2019;6;6;17;Artes marciales mixtas
82;YMD6bCudpQI;7 Exercises to Build Bigger Arms Without Heavy Weights;BRIGHT SIDE;https://www.youtube.com/watch?v=YMD6bCudpQI;2019-06-03T18:00:04Z;2019;6;7;17;Fitness
83;WamU36hXiNw;Tu Primera Clase de Yoga (Nivel principiante);Xuan Lan Yoga;https://www.youtube.com/watch?v=WamU36hXiNw;2019-06-20T18:00:05Z;2019;6;8;17;Yoga
84;d4gVQngYmIg;Perder Peso Bailando En Casa Para Principiantes;Sientete Joven;https://www.youtube.com/watch?v=d4gVQngYmIg;2019-06-30T17:45:01Z;2019;6;9;17;Fitness
85;s2h0tFWwqFc;FREESTYLE SWIMMING: 5 MOST COMMON MISTAKES;SwimUp;https://www.youtube.com/watch?v=s2h0tFWwqFc;2019-06-26T09:00:08Z;2019;6;10;17;Natación
86;Qszm4R4_DJ8;4 Unstoppable Basketball Dribbling Combo Moves | Basketball Scoring Tips;ShotMechanics;https://www.youtube.com/watch?v=Qszm4R4_DJ8;2019-06-19T22:15:48Z;2019;6;11;17;Baloncesto
87;xjPi6IcSH_Q;The BEST Plays of the 2019 NBA Finals | Presented by YouTubeTV;NBA;https://www.youtube.com/watch?v=xjPi6IcSH_Q;2019-06-14T16:00:08Z;2019;6;12;17;Baloncesto
88;quf9rjK9ZsI;100 3-Pointers | Stephen Curry is FIRST in NBA Finals History with 100 3PM;NBA;https://www.youtube.com/watch?v=quf9rjK9ZsI;2019-06-01T13:00:10Z;2019;6;13;17;Baloncesto
89;ul2w0EqtqhQ;Real Madrid official music video | If You Create The Noise, the new away kit by adidas;Real Madrid;https://www.youtube.com/watch?v=ul2w0EqtqhQ;2019-06-27T08:00:07Z;2019;6;14;17;Fútbol
90;g1yfMljc8Dk;Who Played It Best? | Best Lofted Drives of the World Cup | Part 1 | ICC Cricket World Cup 2019;ICC;https://www.youtube.com/watch?v=g1yfMljc8Dk;2019-06-21T12:00:11Z;2019;6;15;17;Cricket
91;dUy11UbxPBc;9-Minute Home Workout for Strong Legs Without Weights;BRIGHT SIDE;https://www.youtube.com/watch?v=dUy11UbxPBc;2019-07-16T03:00:02Z;2019;7;1;17;Fitness
92;ArEf9NCvxjM;Definir y marcar abdomen bajo | Abdominales 10 minutos en casa;gymvirtual;https://www.youtube.com/watch?v=ArEf9NCvxjM;2019-07-15T15:58:47Z;2019;7;2;17;Fitness
93;dRGQDubSAqw;Artistic Swimming - Full Team Event from Rio 2016 | Throwback Thursday;Olympics;https://www.youtube.com/watch?v=dRGQDubSAqw;2019-07-18T11:00:10Z;2019;7;3;17;Natación
94;TjiCXhGuLgw;2019 British Grand Prix: Race Highlights;FORMULA 1;https://www.youtube.com/watch?v=TjiCXhGuLgw;2019-07-14T16:47:21Z;2019;7;4;17;Automovilismo
95;zEmXFGU84W0;Abdomen plano | Rutina para aplanar y tonificar el vientre;gymvirtual;https://www.youtube.com/watch?v=zEmXFGU84W0;2019-07-30T16:00:10Z;2019;7;5;17;Fitness
96;RmvZyC6s_Wk;"Verstappen And Leclerc&#39;s Epic Silverstone Battle | 2019 British Grand Prix";FORMULA 1;https://www.youtube.com/watch?v=RmvZyC6s_Wk;2019-07-16T09:15:02Z;2019;7;6;17;Automovilismo
97;ZacOS8NBK6U;Why the Tour de France is so brutal;Vox;https://www.youtube.com/watch?v=ZacOS8NBK6U;2019-07-25T12:00:07Z;2019;7;7;17;Ciclismo
98;kZU7y2FeTE8;RUTINA DE EJERCICIOS DE BRAZOS, HOMBROS Y PECHO | ADELGAZA BRAZO Y ESPALDA;gymvirtual;https://www.youtube.com/watch?v=kZU7y2FeTE8;2019-07-10T16:00:12Z;2019;7;8;17;Fitness
99;HXBDQpknrZw;Maria Kanellis claims she is pregnant during Mixed Tag Team Match: Raw, July 1, 2019;WWE;https://www.youtube.com/watch?v=HXBDQpknrZw;2019-07-02T04:22:55Z;2019;7;9;17;Lucha libre
100;oQx3SKGN3Rs;"Russell Westbrook BEST &amp; MOST VICIOUS Dunks of His Career! A MUST SEE MONTAGE!";House of Highlights;https://www.youtube.com/watch?v=oQx3SKGN3Rs;2019-07-20T22:55:45Z;2019;7;10;17;Baloncesto
101;I1ertAfrClU;7 Exercises for Men to Build a Big Strong Neck;BRIGHT SIDE;https://www.youtube.com/watch?v=I1ertAfrClU;2019-07-29T11:00:02Z;2019;7;11;17;Fitness
102;hNCjnwKEea4;90 minutos con Pep Guardiola;GOL PLAY;https://www.youtube.com/watch?v=hNCjnwKEea4;2019-07-24T15:20:49Z;2019;7;12;17;Fútbol
103;3mDQKMd4P3E;"The Rock and Roman Reigns talk about family and “Hobbs &amp; Shaw”";WWE;https://www.youtube.com/watch?v=3mDQKMd4P3E;2019-07-31T16:06:33Z;2019;7;13;17;Lucha libre
104;NWanv2PUpqE;TOP 25 GOALS James Rodríguez en LaLiga Santander;LaLiga Santander;https://www.youtube.com/watch?v=NWanv2PUpqE;2019-07-29T10:54:12Z;2019;7;14;17;Fútbol
105;iGMaIxqcSpU;Aprender ATAQUES BÁSICOS en Krav Maga - TUTORIAL EN ESPAÑOL;DeportesUncomo;https://www.youtube.com/watch?v=iGMaIxqcSpU;2019-07-09T17:30:00Z;2019;7;15;17;Artes marciales mixtas
106;4x678Pwpk6A;Impossible Climb Arette | Modified Monster Bikes | Hill Climb;Enduro Life Media;https://www.youtube.com/watch?v=4x678Pwpk6A;2019-08-24T17:07:56Z;2019;8;1;17;Motociclismo
107;BLLFns51FBU;Top 5 closest finishes in MotoGP™️!;MotoGP;https://www.youtube.com/watch?v=BLLFns51FBU;2019-08-27T14:55:01Z;2019;8;2;17;Motociclismo
108;BRCs7yX372Y;First team presentation for the coming 2019 - 2020 season;FC Barcelona;https://www.youtube.com/watch?v=BRCs7yX372Y;2019-08-04T19:12:00Z;2019;8;3;17;Fútbol
109;EA4brrP24-o;BRASIL 🇧🇷 PENTACAMPEÓN 🏆 del MUNDO 🌟;Forza Champions;https://www.youtube.com/watch?v=EA4brrP24-o;2019-08-01T17:00:03Z;2019;8;4;17;Fútbol
110;2fdp8SVOSF4;Simone Biles Stuns With New Triple Double on Floor | Champions Series Presented By Xfinity;Team USA;https://www.youtube.com/watch?v=2fdp8SVOSF4;2019-08-12T04:31:27Z;2019;8;5;17;Gimnasia
111;YjjLw4qypw0;What Goes into Feeding an NFL Team?;NFL;https://www.youtube.com/watch?v=YjjLw4qypw0;2019-08-10T01:00:04Z;2019;8;6;17;Fútbol americano
112;Py1M7x5pGF4;Reducir abdomen | Cintura de avispa | GymVirtual;gymvirtual;https://www.youtube.com/watch?v=Py1M7x5pGF4;2019-08-26T16:00:06Z;2019;8;7;17;Fitness
113;wZnCcqm_g-E;Roger Federer vs Rafael Nadal | Wimbledon 2019 | Full Match;Wimbledon;https://www.youtube.com/watch?v=wZnCcqm_g-E;2019-08-01T13:03:17Z;2019;8;8;17;Tenis
114;gdoDrofgD3U;10 Times The MSN Trio Impressed The World ► Messi - Suárez - Neymar;Messi TheBoss;https://www.youtube.com/watch?v=gdoDrofgD3U;2019-08-28T21:57:27Z;2019;8;9;17;Fútbol
115;iXwbC1EemF4;When Steph Curry BECAME THE UNANIMOUS MVP! BEST Highlights from 2015-16 MVP Season!;House of Highlights;https://www.youtube.com/watch?v=iXwbC1EemF4;2019-08-24T15:22:20Z;2019;8;10;17;Baloncesto
116;bEwahaCI6EM;Endurecer glúteos, abdomen y piernas | Rutina GAP;gymvirtual;https://www.youtube.com/watch?v=bEwahaCI6EM;2019-08-05T16:00:12Z;2019;8;11;17;Fitness
117;_RqteZDjDmQ;"James Harden&#39;s Top 30 Plays of His NBA Career";NBA;https://www.youtube.com/watch?v=_RqteZDjDmQ;2019-08-26T19:00:05Z;2019;8;12;17;Baloncesto
118;hBbVxJNwEFY;"When Kyrie Irving Reached His PEAK! VERY BEST Career Highlights &amp; Plays with the Cavaliers!";House of Highlights;https://www.youtube.com/watch?v=hBbVxJNwEFY;2019-08-17T19:57:15Z;2019;8;13;17;Baloncesto
119;dYurKzP_KNI;How Do F1 Drivers Explain F1?;FORMULA 1;https://www.youtube.com/watch?v=dYurKzP_KNI;2019-08-27T16:48:33Z;2019;8;14;17;Automovilismo
120;ErrnAAa7BiE;"NBA&#39;s Top 100 Crossovers | 2018-19 NBA Season | #NBAHandlesWeek";NBA;https://www.youtube.com/watch?v=ErrnAAa7BiE;2019-08-03T13:00:04Z;2019;8;15;17;Baloncesto
121;kt8FyEv_WNk;Every Goldberg match since his return: WWE Playlist;WWE;https://www.youtube.com/watch?v=kt8FyEv_WNk;2019-09-19T14:14:36Z;2019;9;1;17;Lucha libre
122;Gca-Gil8Fik;Roman Reigns’ unexpected teammates: WWE Top 10, Sept. 28, 2019;WWE;https://www.youtube.com/watch?v=Gca-Gil8Fik;2019-09-28T14:00:02Z;2019;9;2;17;Lucha libre
123;3AZwoTLqCoE;ABDOMINALES DE PIE para Reducir Cintura y Aplanar Abdomen EN 7 Minutos | NatyGlossGym;NatyGloss Gym;https://www.youtube.com/watch?v=3AZwoTLqCoE;2019-09-30T15:56:58Z;2019;9;3;17;Fitness
124;MuWSYVwNiaI;Most Humiliating Goals in Football History;iFutGol;https://www.youtube.com/watch?v=MuWSYVwNiaI;2019-09-26T17:58:30Z;2019;9;4;17;Fútbol
125;OOg-4mtA3Zo;21 Levels of Skateboarding with Tony Hawk: Easy to Complex | WIRED;WIRED;https://www.youtube.com/watch?v=OOg-4mtA3Zo;2019-09-25T16:00:05Z;2019;9;5;17;Skateboarding
126;8I463L8UaTI;Ejercicios con mancuernas | Tonifica brazos y elimina rollitos de la espalda;gymvirtual;https://www.youtube.com/watch?v=8I463L8UaTI;2019-09-19T16:00:02Z;2019;9;6;17;Fitness
127;EMoSsCDgZys;Why It’s Almost Impossible to Make a 7-10 Split in Bowling | WIRED;WIRED;https://www.youtube.com/watch?v=EMoSsCDgZys;2019-09-27T19:00:03Z;2019;9;7;17;Bolos
128;dBaJYWoyG64;200 IQ Football l Smartest Plays In Football;TKHD;https://www.youtube.com/watch?v=dBaJYWoyG64;2019-09-21T10:00:05Z;2019;9;8;17;Fútbol
129;9ON3QFZ6bU4;Sercan Ulusoy - Calisthenics Motivation;Sercan Ulusoy;https://www.youtube.com/watch?v=9ON3QFZ6bU4;2019-09-23T11:03:46Z;2019;9;9;17;Calistenia
130;rCHT7wZSsVc;"#ProsBehindThePros | Episode 1 &quot;Fuelling Barça&quot; by Beko";FC Barcelona;https://www.youtube.com/watch?v=rCHT7wZSsVc;2019-09-19T10:50:57Z;2019;9;10;17;Fútbol
131;sETvbV0oobI;Estiramientos ESTILO YOGA para después de hacer ejercicio;gymvirtual;https://www.youtube.com/watch?v=sETvbV0oobI;2019-09-18T16:00:11Z;2019;9;11;17;Fitness
132;zQfaFZ5OpOs;How To Lock Your Bike In Town | Urban Bike Security Guide;GMBN Tech;https://www.youtube.com/watch?v=zQfaFZ5OpOs;2019-09-15T09:00:23Z;2019;9;12;17;Ciclismo
133;Bg_MG9zUWD4;Calentamiento con ejercicios de movilidad para antes de entrenar;gymvirtual;https://www.youtube.com/watch?v=Bg_MG9zUWD4;2019-09-11T16:00:12Z;2019;9;13;17;Fitness
134;UwMp8Zn1A3w;Ejercicios con mancuernas | Aumentar y levantar pecho;gymvirtual;https://www.youtube.com/watch?v=UwMp8Zn1A3w;2019-09-12T16:00:04Z;2019;9;14;17;Fitness
135;UwDQ84zt5nY;Top 10 SmackDown LIVE moments: WWE Top 10, September 17, 2019;WWE;https://www.youtube.com/watch?v=UwDQ84zt5nY;2019-09-18T16:09:47Z;2019;9;15;17;Lucha libre
136;KQpNlWn4LLc;Braun Strowman and boxing champion Tyson Fury in huge brawl: Raw, Oct. 7, 2019;WWE;https://www.youtube.com/watch?v=KQpNlWn4LLc;2019-10-08T04:18:45Z;2019;10;1;17;Lucha libre
137;7G8sHOJ-plE;Liverpool 5-5 Arsenal (5-4 on penalties) Reds win dramatic 10-goal thriller | Highlights;Liverpool FC;https://www.youtube.com/watch?v=7G8sHOJ-plE;2019-10-31T01:00:00Z;2019;10;2;17;Fútbol
138;tFaadX_vZ2U;mero de 35 kg pesca profunda de Jesus Jimenez Reyes del quipo Polosub y CarbonioGFT;Hermanos Ruiz González;https://www.youtube.com/watch?v=tFaadX_Vz2u;2019-10-07T17:31:25Z;2019;10;3;17;Pesca deportiva
139;Ra_HScKBU_U;"Katelyn Ohashi&#39;s sensational floor routine at the 2019 NCAA gymnastics championship";NCAA Championships;https://www.youtube.com/watch?v=Ra_HScKBU_U;2019-10-08T17:53:27Z;2019;10;4;17;Gimnasia
140;My2R6PWTvNE;Top 10 Friday Night SmackDown moments: WWE Top 10, October 25, 2019;WWE;https://www.youtube.com/watch?v=My2R6PWTvNE;2019-10-26T18:05:46Z;2019;10;5;17;Lucha libre
141;maC9O-WDg2g;Cain Velasquez comes to the aid of Rey Mysterio: Raw, Oct. 21, 2019;WWE;https://www.youtube.com/watch?v=maC9O-WDg2g;2019-10-22T03:05:42Z;2019;10;6;17;Lucha libre
142;L0ESR610dcA;I bought a FAKE golf club from WISH (shocking result);Rick Shiels Golf;https://www.youtube.com/watch?v=L0ESR610dcA;2019-10-31T15:00:04Z;2019;10;7;17;Golf
143;7khKnjJ-uEs;Finn Bálor brutalizes Johnny Gargano: WWE NXT, Oct. 23, 2019;WWE;https://www.youtube.com/watch?v=7khKnjJ-uEs;2019-10-24T03:19:36Z;2019;10;8;17;Lucha libre
144;sxuZzi9sqL0;EJERCICIOS DE ABDOMINALES EN CASA | ABDOMEN PLANO 10 MINUTOS;gymvirtual;https://www.youtube.com/watch?v=sxuZzi9sqL0;2019-10-16T16:00:10Z;2019;10;9;17;Fitness
145;Pr4RBjGpPhE;Joel Embiid and Karl-Anthony Towns fight, get ejected in Timberwolves vs. 76ers | NBA Highlights;ESPN;https://www.youtube.com/watch?v=Pr4RBjGpPhE;2019-10-31T01:49:37Z;2019;10;10;17;Baloncesto
146;JPj5_ygT4G0;CARDIO CAMINANDO EN CASA PARA ADELGAZAR | Rutina sin saltos;Dakidissa S.;https://www.youtube.com/watch?v=JPj5_ygT4G0;2019-10-07T15:34:28Z;2019;10;11;17;Fitness
147;lo792RZ245Y;5 Calisthenics Skills Beginners Can Learn at Home (No Equipment);Ashton Fitness;https://www.youtube.com/watch?v=lo792RZ245Y;2019-10-13T19:24:08Z;2019;10;12;17;Calistenia
