n;id;titulo;canal;categoria;enlace;video_date;video_year;video_mes
440;A_sJxKsw9zo;Soy Una Genio Nacida EN Una Familia De Tontos  -  Reaccionando a Mi Historia Animada;UVE;Reacciones;https://www.youtube.com/watch?v=A_sJxKsw9zo;2021-06-03T14:00:06Z;2021;6
441;RRzG7WmJGgs;"Panfilov&#39;s 28 - Best Scene - I have watched the most shocking World War II movie";Xevozy;Películas;https://www.youtube.com/watch?v=RRzG7WmJGgs;2021-06-09T04:30:10Z;2021;6
442;B7ThG3zYwFQ;¡CANTA 2! – Tráiler Oficial (Illumination Studios) - HD;Illumination Spain;Películas animadas;https://www.youtube.com/watch?v=B7ThG3zYwFQ;2021-06-24T15:24:40Z;2021;6
443;0VNxlkC5SbQ;👯 DESAFÍO CHICA BUENA VS CHICA MALA! 👑 ANGEL vs DEMONIO  -  -  ¡Momentos divertidos de buenas y malas;Karina & Marina;Exploración;https://www.youtube.com/watch?v=0VNxlkC5SbQ;2021-06-02T16:00:00Z;2021;6
444;Bsc0flIcxxY;Gorka y Maica: un amor escondido y una pasión desenfrenada;Telenovelas;Telenovelas;https://www.youtube.com/watch?v=Bsc0flIcxxY;2021-06-03T16:08:07Z;2021;6
445;lfdj0XtetXQ;ENCIERRO A LOS CHICOS EN MI CAJA IRROMPIBLE!!;Vanesa Basanta;Vlogs;https://www.youtube.com/watch?v=lfdj0XtetXQ;2021-06-04T17:00:13Z;2021;6
446;NabMsZ9Z2mM;Fabrica Tu Ciudad de Carton;LeoTube;Hobbies y manualidades;https://www.youtube.com/watch?v=NabMsZ9Z2mM;2021-06-19T18:15:11Z;2021;6
447;u7j6qLvn7Es;MAÑANAS DE SÁBADO MINION  -  Episodio 3: Golf (Illumination Entertainment) HD;Illumination Spain;Películas animadas;https://www.youtube.com/watch?v=u7j6qLvn7Es;2021-06-26T05:00:23Z;2021;6
448;KeZ6DsUaCtI;🍉 Aprendemos las FRUTAS 🍒 Dibuja y Colorea una SANDÍA KAWAII;Asubio Kids;Entretenimiento Infantil;https://www.youtube.com/watch?v=KeZ6DsUaCtI;2021-06-29T17:00:09Z;2021;6
449;VCzWz94OY3s;SI TE RIES, TIENES QUE REINICIAR ESTE VIDEO !!  -  Edición Tik Tok;UVE;Videos divertidos;https://www.youtube.com/watch?v=VCzWz94OY3s;2021-06-28T14:00:08Z;2021;6
450;ip_DHzt0rCo;El TELEFONO GAMER de LEO;LeoTube;Tecnología;https://www.youtube.com/watch?v=ip_DHzt0rCo;2021-06-25T18:00:12Z;2021;6
451;9fSYp-eDFCU;BROMA CON LA CINTA #shorts;Karina & Marina;Entretenimiento Cómico;https://www.youtube.com/watch?v=9fSYp-eDFCU;2021-07-23T16:00:15Z;2021;7
452;Ey3nR6EGI28;Mi nuevo amigo - Hucha con cara;jiajunyin2;Entretenimiento Creativo;https://www.youtube.com/watch?v=Ey3nR6EGI28;2021-07-15T18:23:39Z;2021;7
453;3OMhkQREQpM;EL ATAQUE.EXE (Episodio Final) 😨💥 LAS PERRERÍAS DE MIKE Ep. 20 (Temporada 1);Mikecrack;Entretenimiento Animado;https://www.youtube.com/watch?v=3OMhkQREQpM;2021-07-03T20:41:11Z;2021;7
454;wV_SAnXyoP0;Mi tercera MANO;jiajunyin2;Entretenimiento Creativo;https://www.youtube.com/watch?v=wV_SAnXyoP0;2021-07-14T17:44:35Z;2021;7
455;D2sd_3FLL_w;Marvel Spidey y su Superequipo: El equipo Spidey  -  Disney Junior Oficial;Disney Junior España;Entretenimiento Infantil;https://www.youtube.com/watch?v=D2sd_3FLL_w;2021-07-31T12:30:05Z;2021;7
456;05T_tAhQNLc;MI EX ME GASTA LA BROMA Y LE SALE MAL #shorts;Karina & Marina;Entretenimiento Cómico;https://www.youtube.com/watch?v=05T_tAhQNLc;2021-07-30T16:00:01Z;2021;7
457;MH9-tSpAHQ8;Marvel Spidey y su Superequipo: Spidersorpresa  -  Disney Junior Oficial;Disney Junior España;Entretenimiento Infantil;https://www.youtube.com/watch?v=MH9-tSpAHQ8;2021-07-24T12:30:14Z;2021;7
458;xULTA72la2U;🛍️BOLSO MAGICO 🛍️ BROMA A MI HERMANA GEMELA  #shorts;Karina & Marina;Entretenimiento Cómico;https://www.youtube.com/watch?v=xULTA72la2U;2021-07-22T16:00:24Z;2021;7
459;ElQ_dBAfs2s;**BROMA con FINAL INESPERADO** #shorts;LOL Retos Divertidos;Entretenimiento Cómico;https://www.youtube.com/watch?v=ElQ_dBAfs2s;2021-07-05T20:38:31Z;2021;7
460;gWy0OMr9e6A;Pesar 426 kilos: así es la vida de Samantha, uno de los casos más extremos  -  Mi vida con 300 kilos;DMAX España;uno de los casos más extremos - Mi vida con 300 kilos;https://www.youtube.com/watch?v=gWy0OMr9e6A;2021-07-30T20:00:23Z;2021;7
461;zNsFWCHDhmg;#VIDEO ले लो पुदीना - ले लो गरईया मछरी  -  -  Le Lo Pudinaऔर Garaiya Machhari #Pawan Singh #Silpi Raj;Rangoli Music;Música;https://www.youtube.com/watch?v=zNsFWCHDhmg;2021-07-23T12:45:04Z;2021;7
462;YjMgIhye3so;14 Acertijos Difíciles Que Solo El 2 % De La Gente Puede Resolver;UVE;Entretenimiento Intelectual;https://www.youtube.com/watch?v=YjMgIhye3so;2021-07-24T14:00:24Z;2021;7
463;4W2zK3w_Mj8;BROMA DE GEMELAS #shorts;Karina & Marina;Entretenimiento Cómico;https://www.youtube.com/watch?v=4W2zK3w_Mj8;2021-07-20T16:00:02Z;2021;7
464;dSOsScW9Zv8;¡CÓMO HACER ESCULTURA de ARENA de MIKECRACK en la VIDA REAL! 😱⛱;Mikecrack;Entretenimiento Creativo;https://www.youtube.com/watch?v=dSOsScW9Zv8;2021-07-15T01:37:42Z;2021;7
465;HiQEcc8iXcM;FRIDAY NIGHT FUNKIN HS - CAPITULO 01 - Serie Animada;eddochan;Entretenimiento Animado;https://www.youtube.com/watch?v=HiQEcc8iXcM;2021-07-30T19:00:09Z;2021;7
466;KQad6A_x6NM;Coincidencias De Una En Un Millón Parte 10 #shorts;Dani itss;Entretenimiento Curioso;https://www.youtube.com/watch?v=KQad6A_x6NM;2021-08-07T17:33:08Z;2021;8
467;KDqHZyh-zbY;"Tiësto, KAROL G - Don&#39;t Be Shy (Lyrics)";The Vibe Guide;KAROL G - Don't Be Shy (Lyrics);https://www.youtube.com/watch?v=KDqHZyh-zbY;2021-08-17T12:21:46Z;2021;8
468;b60xgnI5uJo;COMO NOS METEMOS A LA PISCINA? 💦 Retos Virales 2021 / Yippee Family #shorts;Yippee Family;Entretenimiento Cómico;https://www.youtube.com/watch?v=b60xgnI5uJo;2021-08-28T12:00:16Z;2021;8
469;R6vJe6Smd20;QUIEN LA TIENE MÁS GRANDE? 😂 #Shorts;TOBBALink;Entretenimiento Cómico;https://www.youtube.com/watch?v=R6vJe6Smd20;2021-08-04T14:17:03Z;2021;8
470;PQPdkVKzMbE;DESAFIO VIRAL DE LA SEMANA 😜 DANIELA # Shorts;Daniela Baby Pink;Entretenimiento Cómico;https://www.youtube.com/watch?v=PQPdkVKzMbE;2021-08-21T13:00:08Z;2021;8
471;0pGtvrhaL4o;TRADEO de POP IT vs DINOSAURIOS;Las Aventuras de Dani y Evan;Entretenimiento Infantil;https://www.youtube.com/watch?v=0pGtvrhaL4o;2021-08-27T16:29:07Z;2021;8
472;vQrkt54ArCE;24H COMIENDO Y VIVIENDO DE UN SOLO COLOR;Vanesa Basanta;Entretenimiento Cómico;https://www.youtube.com/watch?v=vQrkt54ArCE;2021-08-13T18:00:12Z;2021;8
473;ZO75PQleYXo;LEO MESSI ME INVITA A SU PRESENTACIÓN EN PARÍS - VLOG;Ibai;Entretenimiento Vlog;https://www.youtube.com/watch?v=ZO75PQleYXo;2021-08-12T19:54:23Z;2021;8
474;wp28kJB2hbU;** BROMA a MARIELA ** 😱  #Shorts;MARIELA;Entretenimiento Cómico;https://www.youtube.com/watch?v=wp28kJB2hbU;2021-08-29T18:00:14Z;2021;8
475;V8Iz1jbvUz4;Hicimos este Baile TREND de TikTok super divertido 😝Con FresaJapoMex 😂con quien lo harian? #Shorts;Sky and Tami;Entretenimiento Baile;https://www.youtube.com/watch?v=V8Iz1jbvUz4;2021-08-31T22:15:41Z;2021;8
476;3b23IdvzmC8;EL PRIMERO EN ESCAPAR DE LA PRISIÓN DEL CASTILLO SE SALVA! (imposible);YoSoyPlex;Entretenimiento Desafío;https://www.youtube.com/watch?v=3b23IdvzmC8;2021-08-25T19:15:01Z;2021;8
477;YoSH7iXADE4;¡Paso un Loco día de Piscina con mi Amiga Pija! Toca Boca Life World;Iris Arcoiris;Entretenimiento Infantil;https://www.youtube.com/watch?v=YoSH7iXADE4;2021-08-30T17:15:58Z;2021;8
478;URg8DFOh_3E;PASTEL de MIKECRACK en 1 DÍA  -  1 HORA  -  1 MINUTO 😍🎂 ¿CÚAL ES MEJOR?;Mikecrack;Entretenimiento Culinario;https://www.youtube.com/watch?v=URg8DFOh_3E;2021-08-15T04:28:05Z;2021;8
479;sr60pH6WBYc;HACEMOS UN CAMINO DE CARNE PARA SACAR AL TIGRE DE NUESTRA CASA!;YoSoyPlex;Entretenimiento Desafío;https://www.youtube.com/watch?v=sr60pH6WBYc;2021-08-14T20:00:17Z;2021;8
480;aZ_Y2JBMYeQ;¡NUNCA VI ESTO! JUGUETES HANGREES HACEN POPO/SLIME  -  QUIEN INVENTO ESTO;Timon se ha Vuelto Loco;Entretenimiento Curioso;https://www.youtube.com/watch?v=aZ_Y2JBMYeQ;2021-08-18T20:00:00Z;2021;8
481;e_eMopzB8i4;Video Triệu View Thỏa Mãn Người Xem  -  Best Videos Oddly Satisfying ( P304 ) #Shorts;Saa Satisfying;Entretenimiento Curioso;https://www.youtube.com/watch?v=e_eMopzB8i4;2021-09-21T04:14:13Z;2021;9
482;9rPhjzKp82g;ME ROMPÍ LOS PANTALONES! 😳🤣;Yod'in Galactic;Entretenimiento Cómico;https://www.youtube.com/watch?v=9rPhjzKp82g;2021-09-21T15:20:50Z;2021;9
483;B4-L2nfGcuE;Big Bear Bald Eagle Live Nest - Cam 1;FOBBV CAM;Naturaleza;https://www.youtube.com/watch?v=B4-L2nfGcuE;2021-09-15T22:09:49Z;2021;9
484;WMv50mpfYr0;SE ACERCA EL FIN DEL MUNDO?😱 #shorts;Inmagic;Entretenimiento Curioso;https://www.youtube.com/watch?v=WMv50mpfYr0;2021-09-02T18:32:54Z;2021;9
485;QURbxHDXV9Y;TROLLEO a INVICTOR con MAGIA ✨😂 (se queda loco!!)  -  Mikecrack #Shorts;Mikecrack;Entretenimiento Cómico;https://www.youtube.com/watch?v=QURbxHDXV9Y;2021-09-19T16:35:10Z;2021;9
486;of_3rje8oKA;MHD  -  -  BZRP Music Sessions #44;Bizarrap;Música;https://www.youtube.com/watch?v=of_3rje8oKA;2021-09-15T22:00:32Z;2021;9
487;yP00So5C5tM;تحولت إلى حورية بحر في المسبح;العائلة المجنونة;Entretenimiento Creativo;https://www.youtube.com/watch?v=yP00So5C5tM;2021-09-21T15:51:59Z;2021;9
488;CwnlNQSHBfc;Ft. Madison, Iowa USA   -  Virtual Railfan LIVE;Virtual Railfan;Live;https://www.youtube.com/watch?v=CwnlNQSHBfc;2021-09-24T10:30:18Z;2021;9
489;WsqrQUQqj6g;THE BEST OF SEASON 7 CHAPTER 2 (S17) - FORTNITE CHALLENGE  -  tusadivi;tusadivi;Entretenimiento de Videojuegos;https://www.youtube.com/watch?v=WsqrQUQqj6g;2021-09-09T16:52:45Z;2021;9
490;FvHThtOPrek;ESCAMEO TRADEO POP IT FIDGET A VANESA *SE ENFADA MUCHO!*;Vanesa Basanta;Entretenimiento Infantil;https://www.youtube.com/watch?v=FvHThtOPrek;2021-09-07T18:00:13Z;2021;9
491;-OE9jMCU13k;SI TE RÍES PIERDES #8;Ibai;Entretenimiento Cómico;https://www.youtube.com/watch?v=-OE9jMCU13k;2021-09-19T14:54:40Z;2021;9
492;DyET9VQZA3E;COMIENDO EN EL RESTAURANTE MÁS CARO DE BARCELONA;Ibai;Entretenimiento Gastronómico;https://www.youtube.com/watch?v=DyET9VQZA3E;2021-10-01T19:47:13Z;2021;9
493;z0THUTuRGJE;Bluey: La pluma mágica  -  Disney Junior Oficial;Disney Junior España;Entretenimiento Infantil;https://www.youtube.com/watch?v=z0THUTuRGJE;2021-09-26T15:00:35Z;2021;9
494;e9yxPyKhi-0;DESMINTIENDO LIFE HACKS ESTÚPIDOS en la VIDA REAL 💩😂 LA COCINA DE MIKECRACK #15;Mikecrack;Entretenimiento Cómico;https://www.youtube.com/watch?v=e9yxPyKhi-0;2021-09-22T17:30:03Z;2021;9
495;2yCmcPJEB1w;TRADEO TRIPLE de POP IT !! Dani y Evan CAEN en LA TRAMPA!!;Las Aventuras de Dani y Evan;Entretenimiento Infantil;https://www.youtube.com/watch?v=2yCmcPJEB1w;2021-09-14T16:19:01Z;2021;9
496;Vepc0asQC3I;LA DESPEDIDA DE TROLLI 😥💔 LAS PERRERÍAS DE MIKE Ep. 1 (Temporada 2);Mikecrack;Entretenimiento Animado;https://www.youtube.com/watch?v=Vepc0asQC3I;2021-10-15T18:00:12Z;2021;10
497;zRXz-cdsuDk;EL ORIGEN DE HALLOWEEN 🎃🍬 Las Perrerías de Mike Ep. 2 (Temporada 2) [ESPECIAL DE HALLOWEEN 2021];Mikecrack;Entretenimiento Animado;https://www.youtube.com/watch?v=zRXz-cdsuDk;2021-10-29T17:30:09Z;2021;10
498;BENxE-qtifY;EL JUEGO DEL CALAMAR Luz Verde Tira de la Cuerda;FamilyTube;Entretenimiento Juego;https://www.youtube.com/watch?v=BENxE-qtifY;2021-10-23T18:00:11Z;2021;10
499;-tMTI-D7DBQ;"I&#39;m A Boy..Koreans Meet Cross Dresser For The First Time";GIGGLE;Entretenimiento Social;https://www.youtube.com/watch?v=-tMTI-D7DBQ;2021-10-07T17:00:00Z;2021;10
500;fnaNSD7KNNE;ASÍ CONSEGUÍ CAMBIAR MI FÍSICO EN 3 MESES #shorts;ArteMaster;Entretenimiento de Estilo de Vida;https://www.youtube.com/watch?v=fnaNSD7KNNE;2021-10-11T18:21:16Z;2021;10
501;PQExnSUMBnw;Dani y Evan y el MEGA LABORATORIO de MONSTRUOS de Treasure X MONSTER GOLD;Las Aventuras de Dani y Evan;Entretenimiento Infantil;https://www.youtube.com/watch?v=PQExnSUMBnw;2021-10-22T18:00:11Z;2021;10
502;DyET9VQZA3E;COMIENDO EN EL RESTAURANTE MÁS CARO DE BARCELONA;Ibai;Entretenimiento Gastronómico;https://www.youtube.com/watch?v=DyET9VQZA3E;2021-10-01T19:47:13Z;2021;10
503;id1c-bZg-eM;CUANDO DE PEQUEÑO TE PINTABAS EL CUERPO EN EL COLEGIO 😎 #shorts;Pedro Palencia;Entretenimiento Cómico;https://www.youtube.com/watch?v=id1c-bZg-eM;2021-10-16T10:06:00Z;2021;10
504;tb2O4ramlUY;19 ANIMALES MÁS GRANDES y más PELIGROSOS DEL MUNDO;WILD ANIMALS salvajes;Entretenimiento Curioso;https://www.youtube.com/watch?v=tb2O4ramlUY;2021-10-26T00:12:59Z;2021;10
505;DQdiG-Ti2jk;LAVA la ROPA en la PISCINA para AHORRAR - REACCIONANDO A TACAÑOS EXTREMOS;Ibai;Entretenimiento de Estilo de Vida;https://www.youtube.com/watch?v=DQdiG-Ti2jk;2021-10-31T19:30:03Z;2021;10
506;JFOq9UmnB5I;深田えいみに全裸になってもらいたい部;ジュキヤ/Jukiya;Entretenimiento para Adultos;https://www.youtube.com/watch?v=JFOq9UmnB5I;2021-10-17T10:00:07Z;2021;10
507;tyO_4vWBfA8;REACCIONANDO A DRAGON BALL LATINO VS ESPAÑOL ¿CUÁL ES MEJOR? - TheGrefg;TheGrefg;Entretenimiento de Videojuegos;https://www.youtube.com/watch?v=tyO_4vWBfA8;2021-10-16T21:05:09Z;2021;10
508;QA1FWjqs1X0;MI NUEVA SKIN DE MINECRAFT!! 😱 TRAILER Las PERRERÍAS de MIKE T2 y MÁS 🔥 MIKECRACK MIKEXPO 2021;Mikecrack;Entretenimiento Animado;https://www.youtube.com/watch?v=QA1FWjqs1X0;2021-10-07T18:00:14Z;2021;10
509;gY2ZyL93BwA;#13 DERROTAMOS AL CLAN DE LOS PAYASOS ZOMBIES!!!;La Familink;Entretenimiento de Videojuegos;https://www.youtube.com/watch?v=gY2ZyL93BwA;2021-10-17T15:13:16Z;2021;10
510;m-hGOXKBdG0;Bluey: En casa de la abuela  -  Disney Junior Oficial;Disney Junior España;Entretenimiento Infantil;https://www.youtube.com/watch?v=m-hGOXKBdG0;2021-10-18T15:20:46Z;2021;10
511;OaMjsxx7dJ0;Cuando te regalan un perro 🐶😂 #shorts;animaLize21;Entretenimiento Cómico;https://www.youtube.com/watch?v=OaMjsxx7dJ0;2021-11-25T17:07:27Z;2021;11
512;G6x5GCEBMXY;CUMPLEAÑOS DE BRUNO;FamilyTube;Entretenimiento Familiar;https://www.youtube.com/watch?v=G6x5GCEBMXY;2021-11-27T19:00:10Z;2021;11
513;AC3uUBbJ6rs;Sándwich PERFECTO de Hora de Aventura en LA VIDA REAL;La Cocina Del Pirata;Entretenimiento Culinario;https://www.youtube.com/watch?v=AC3uUBbJ6rs;2021-11-08T18:30:17Z;2021;11
514;osN84NkedSc;DOY 500€ AL QUE MÁS ME HAGA REÍR  -  SI TE RÍES PIERDES 9;Ibai;Entretenimiento Cómico;https://www.youtube.com/watch?v=osN84NkedSc;2021-11-03T21:42:00Z;2021;11
515;-ObSi1u6oHc;5 Creative Photography Ideas you must try;Jordi Koalitic;Entretenimiento Creativo;https://www.youtube.com/watch?v=-ObSi1u6oHc;2021-11-18T14:02:35Z;2021;11
516;LEBu88yXJ90;Compilado: los momentos más divertidos de Bluey y Bingo  -  Disney Junior Oficial;Disney Junior España;Entretenimiento Infantil;https://www.youtube.com/watch?v=LEBu88yXJ90;2021-11-20T10:00:07Z;2021;11
517;M8pyAtqL35o;Funda para Dedo;jiajunyin2;Entretenimiento Curioso;https://www.youtube.com/watch?v=M8pyAtqL35o;2021-11-19T21:24:25Z;2021;11
518;AfgP9tjIt9o;cuando tu amigo y su novia discuten delante de ti;Ibai;Entretenimiento Cómico;https://www.youtube.com/watch?v=AfgP9tjIt9o;2021-11-08T19:07:16Z;2021;11
519;Lyg2RFN9xHI;Mickey Mouse Funhouse: Una aventura acuática  -  Disney Junior Oficial;Disney Junior España;Entretenimiento Infantil;https://www.youtube.com/watch?v=Lyg2RFN9xHI;2021-11-23T10:00:08Z;2021;11
520;4dP03cSR2L4;#21 LE SACAMOS LA MÁSCARA A LOS ZOMBIES!!!;La Familink;Entretenimiento de Videojuegos;https://www.youtube.com/watch?v=4dP03cSR2L4;2021-11-26T14:31:36Z;2021;11
521;EqOgWftXsuo;Casais transam usando brinquedinhos eróticos  -  Rio Shore T1;Rio Shore;Entretenimiento para Adultos;https://www.youtube.com/watch?v=EqOgWftXsuo;2021-11-30T15:00:08Z;2021;11
522;arioeUqSSMs;¡CANTA 2! – Tráiler Final (Illumination Studios) HD;Illumination Spain;Entretenimiento de Cine;https://www.youtube.com/watch?v=arioeUqSSMs;2021-11-24T16:36:52Z;2021;11
523;11_w83LogEw;TENGO MIEDO  -  Poppy Playtime;Ibai;Entretenimiento de Videojuegos;https://www.youtube.com/watch?v=11_w83LogEw;2021-11-11T22:49:28Z;2021;11
524;VWUBmb-pkPI;24 Horas COCINANDO a MIKECRACK TODO LO QUE QUIERA! 🥞;La Cocina Del Pirata;Entretenimiento Culinario;https://www.youtube.com/watch?v=VWUBmb-pkPI;2021-11-18T19:30:04Z;2021;11
525;cdd3tTD1SDU;Transformers Bumblebee Cyberverse Adventures⚡️2 PART SPECIAL⚡️(1/2) ⚡️The Immobilizers⚡️FULL Episode;TRANSFORMERS OFFICIAL;Entretenimiento de Animación;https://www.youtube.com/watch?v=cdd3tTD1SDU;2021-11-06T12:00:31Z;2021;11
526;CTBZW8BVthA;El mejor conductor de camiones.La maniobra perfecta #conductor #maniobra #shorts#camion Málaga#reels;Alvaro De Linares;Entretenimiento Cómico;https://www.youtube.com/watch?v=CTBZW8BVthA;2021-12-16T16:20:21Z;2021;12
527;FsF3o9XNcN8;MORAD  -  -  BZRP Music Sessions #47;Bizarrap;Entretenimiento Musical;https://www.youtube.com/watch?v=FsF3o9XNcN8;2021-12-08T22:00:05Z;2021;12
528;Wixxlj8_mC8;Ir a la peluquería con tu madre😂 #shorts;animaLize21;Entretenimiento Cómico;https://www.youtube.com/watch?v=Wixxlj8_mC8;2021-12-02T19:05:50Z;2021;12
529;zcWXboTnous;🔴 AMÉRICA EN VIVO - Actualidad, noticias y espectáculos;América TV;noticias y espectáculos;https://www.youtube.com/watch?v=zcWXboTnous;2021-12-06T17:09:46Z;2021;12
530;_ag1Nmm1LCU;Niños ANTES vs AHORA en la piscina 😂 #shorts;animaLize21;Entretenimiento Cómico;https://www.youtube.com/watch?v=_ag1Nmm1LCU;2021-12-20T15:46:07Z;2021;12
531;pzR8RAl7LYI;Cuando comes en casa de tu amigo 😂⚡️ #shorts;animaLize21;Entretenimiento Cómico;https://www.youtube.com/watch?v=pzR8RAl7LYI;2021-12-19T15:31:09Z;2021;12
532;_FMplFlIiOU;REWIND HISPANO 2021 [Alecmolon];Alec Hernández;Entretenimiento de Resumen;https://www.youtube.com/watch?v=_FMplFlIiOU;2021-12-28T19:01:30Z;2021;12
533;lEyEUdmRYnM;EL OSCURO SECRETO DE MIKE.EXE 🤫😱 Las Perrerías de Mike Ep. 4 (Temporada 2);Mikecrack;Entretenimiento Animado;https://www.youtube.com/watch?v=lEyEUdmRYnM;2021-12-04T00:00:10Z;2021;12
534;TC9LELmbysw;Tanque Destruyendo Coche 💣😱 #shorts;YoSoyPlex Tambien;Entretenimiento Cómico;https://www.youtube.com/watch?v=TC9LELmbysw;2021-12-22T21:03:25Z;2021;12
535;ltKoQb2mc70;Cuando COMES las UVAS en FIN DE AÑO🥳🍇 #shorts;YERRIKILLERXD;Entretenimiento Cómico;https://www.youtube.com/watch?v=ltKoQb2mc70;2021-12-30T18:57:48Z;2021;12
536;-1x9hhSspvg;Esto es muy útil para las Sillas;jiajunyin2;Entretenimiento Curioso;https://www.youtube.com/watch?v=-1x9hhSspvg;2021-12-15T15:47:42Z;2021;12
537;jg0H9uvZa-c;Minero - Versión Orquestal (Especial 10 Años);elrubiusOMG;Entretenimiento Musical;https://www.youtube.com/watch?v=jg0H9uvZa-c;2021-12-02T20:01:55Z;2021;12
538;eL9kAKj9ThQ;LOS COMPAS JUEGAN al ESCONDITE 😂😋 Las Perrerías de Mike Ep. 5 (Temporada 2);Mikecrack;Entretenimiento Animado;https://www.youtube.com/watch?v=eL9kAKj9ThQ;2021-12-17T19:00:13Z;2021;12
539;2flTgDDGUVw;¡SALVAMOS la NAVIDAD RESCATANDO a PAPÁ NOEL! 🎅🎄 Las Perrerías de Mike Ep. 06 (Temporada 2);Mikecrack;Entretenimiento Animado;https://www.youtube.com/watch?v=2flTgDDGUVw;2021-12-24T19:00:11Z;2021;12
540;RBN-f8CYLYM;¿Cuanto Tiempo Sobrevivirias En Otros Planetas? #shorts;Rubenete;Entretenimiento Cómico;https://www.youtube.com/watch?v=RBN-f8CYLYM;2021-12-13T14:11:52Z;2021;12
541;2oWKfUewV8g;Cuando estás en el baño y entra tu amigo 😡🚽;YoSoyPlex Tambien;Entretenimiento Cómico;https://www.youtube.com/watch?v=2oWKfUewV8g;2022-01-16T19:36:43Z;2022;1
542;Q4yshZt2Rbk;ESCAPO del JUEGO DEL CALAMAR *SQUID GAMES* haciendo PARKOUR🦑 PERSECUCIÓN POV 2.0;Álex Segura LR;Entretenimiento de Acción;https://www.youtube.com/watch?v=Q4yshZt2Rbk;2022-01-22T14:00:09Z;2022;1
543;h8nzeGCYBRM;Mi dedo está mamadísimo y te lo demuestro en este vídeo;jiajunyin2;Entretenimiento Cómico;https://www.youtube.com/watch?v=h8nzeGCYBRM;2022-01-29T14:17:54Z;2022;1
544;V_4mBjjmQG0;VERDADERO O FALSO? ✅❌ #shorts;Charlyokei;Entretenimiento Cómico;https://www.youtube.com/watch?v=V_4mBjjmQG0;2022-01-26T15:00:14Z;2022;1
545;cTW9P-mAohM;Bluey: La isla alfombra  -  Disney Junior Oficial;Disney Junior España;Entretenimiento Infantil;https://www.youtube.com/watch?v=cTW9P-mAohM;2022-01-18T10:30:11Z;2022;1
546;p1P5Bmhet-0;24H en la GUARIDA GAMER con HUGGY WUGGY 10;FamilyTube;Entretenimiento Familiar;https://www.youtube.com/watch?v=p1P5Bmhet-0;2022-01-11T19:00:13Z;2022;1
547;eAwxAWlN7AU;PROBANDO los NUEVOS MENÚS de RUBIUS, WILLYREX Y VEGETTA;Ibai;WILLYREX Y VEGETTA;https://www.youtube.com/watch?v=eAwxAWlN7AU;2022-01-28T22:04:12Z;2022;1
548;lpLkSInrA6o;24H en la JUGUETERIA con HUGGY WUGGY;FamilyTube;Entretenimiento Familiar;https://www.youtube.com/watch?v=lpLkSInrA6o;2022-01-04T19:00:11Z;2022;1
549;N1CGCGykWS0;DÍA DE REYES MAGOS 2022;FamilyTube;Entretenimiento Familiar;https://www.youtube.com/watch?v=N1CGCGykWS0;2022-01-08T19:00:13Z;2022;1
550;KiamqKheWsw;Cosas Que NUNCA Desearía Encontrar En Google Maps;UVE;Entretenimiento Curioso;https://www.youtube.com/watch?v=KiamqKheWsw;2022-01-16T15:00:11Z;2022;1
551;WtGIoRFaDyo;Ella Pensó Que Su Hermano Pequeño Estaba Muerto...;UVE;Entretenimiento Dramático;https://www.youtube.com/watch?v=WtGIoRFaDyo;2022-01-28T15:00:31Z;2022;1
552;dHQYM3QeCPk;Atrapamos a Huggy Wuggy;FamilyTube;Entretenimiento Familiar;https://www.youtube.com/watch?v=dHQYM3QeCPk;2022-01-18T19:00:11Z;2022;1
553;gQlGJbQlTRw;Bluey: Bluey y sus amigos  -  Disney Junior Oficial;Disney Junior España;Entretenimiento Infantil;https://www.youtube.com/watch?v=gQlGJbQlTRw;2022-01-26T10:00:32Z;2022;1
554;quwPzUen6G8;"Pepa Madrigal crying over Grandma love story  -  &quot;Encanto&quot;  Unknown Scene";SANDERS WAALS;Entretenimiento Emocional;https://www.youtube.com/watch?v=quwPzUen6G8;2022-01-21T20:15:02Z;2022;1
555;s3Z3FaiKhi0;Bluey: Dulces sueños  -  Disney Junior Oficial;Disney Junior España;Entretenimiento Infantil;https://www.youtube.com/watch?v=s3Z3FaiKhi0;2022-01-03T10:00:19Z;2022;1
556;6aUtqLS_d_U;ADIVINA LA PATATA CALIENTE #shorts;Charlyokei;Entretenimiento de Juegos;https://www.youtube.com/watch?v=6aUtqLS_d_U;2022-02-22T14:00:03Z;2022;2
557;m4BVi4Pntsg;TROLLI y ROBERTA ADOPTAN a MIKE 🐶🥰 LasPerrerías de Mike Ep. 8 (Temporada 2);Mikecrack;Entretenimiento Animado;https://www.youtube.com/watch?v=m4BVi4Pntsg;2022-02-22T21:00:11Z;2022;2
558;eHpbRbNxZiI;Los cuentos de Minnie -  El palacio de las fiestas: Compilado de episodios 1 al 8  -  DJ  Oficial;Disney Junior España;Entretenimiento Infantil;https://www.youtube.com/watch?v=eHpbRbNxZiI;2022-02-13T10:00:13Z;2022;2
559;IWVNHExsznA;Sí o no... COMIDA 🍎🥦 #Shorts #Invictor;invictor;Entretenimiento de Preguntas;https://www.youtube.com/watch?v=IWVNHExsznA;2022-02-13T22:41:37Z;2022;2
560;y1G4mdoByrc;EL REENCUENTRO de MIKE y AKELA 😱😍 Las Perrerías de Mike Ep. 07 (Temporada 2);Mikecrack;Entretenimiento Animado;https://www.youtube.com/watch?v=y1G4mdoByrc;2022-02-06T19:00:12Z;2022;2
561;LaZk2mV91j8;💗Familia Madrigal💗 #encanto #tocaboca #shorts #mirabel #isabela #luisa #encantodisney;Historias con Ruth ;Entretenimiento Familiar;https://www.youtube.com/watch?v=LaZk2mV91j8;2022-02-23T15:00:16Z;2022;2
562;hbYnCAIdwuo;Colorea a ELLY enfermera y a POCOYÓ con varicela 🩺💙 Dibujos para niños;Asubio Kids;Entretenimiento Infantil;https://www.youtube.com/watch?v=hbYnCAIdwuo;2022-02-19T17:00:21Z;2022;2
563;vwBhdq8mDcU;24h en SILENCIO Quien habla pierde;FamilyTube;Entretenimiento de Desafío;https://www.youtube.com/watch?v=vwBhdq8mDcU;2022-02-19T19:00:10Z;2022;2
564;MX-qWlJ1TnU;DOY 300€ AL QUE MÁS ME HAGA REÍR  -  SI TE RÍES PIERDES 12;Ibai;Entretenimiento Cómico;https://www.youtube.com/watch?v=MX-qWlJ1TnU;2022-02-08T22:01:06Z;2022;2
565;7vlN9KPf0EA;24H fabrica tu Castillo de Carton anti Huggy;FamilyTube;Entretenimiento Familiar;https://www.youtube.com/watch?v=7vlN9KPf0EA;2022-02-15T19:00:13Z;2022;2
566;5DmzabjxDWE;QUIÉN RÍE EL ÚLTIMO RÍE MEJOR;Daniela Baby Pink;Entretenimiento de Comedia;https://www.youtube.com/watch?v=5DmzabjxDWE;2022-02-12T14:00:04Z;2022;2
567;vvoAbGpLgxQ;PRIMARIA VS SECUNDARIA #clase #shorts 😂📚;Yosoyjosema;Entretenimiento Cómico;https://www.youtube.com/watch?v=vvoAbGpLgxQ;2022-03-03T16:56:22Z;2022;2
568;11rZFty5FXo;ASALTO EL STREAM DE AURON;Ibai;;https://www.youtube.com/watch?v=11rZFty5FXo;2022-02-09T16:14:41Z;2022;2
569;0I-wG0c97V4;Fui a la nueva tienda del futuro donde NO PAGAS las cosas 💴🚫  -  Amazon Go;YoSoyPlex;Entretenimiento de Viajes;https://www.youtube.com/watch?v=0I-wG0c97V4;2022-02-18T20:30:00Z;2022;2
570;WLqfwUi7Vbc;COMO INVOCAR A SONIC.EXE EN MINECRAFT #Shorts #Cortos  -  MINECRAFT SHORTS LEON PICARON;León Picarón;Entretenimiento de Videojuegos;https://www.youtube.com/watch?v=WLqfwUi7Vbc;2022-02-19T20:05:58Z;2022;2
571;DYduaxXr9KM;Mi vecino robó mi perro;YoSoyPlex;Entretenimiento Cómico;https://www.youtube.com/watch?v=DYduaxXr9KM;2022-03-20T19:40:39Z;2022;3
572;WvZ0PvvTEUU;Mi hermana habla en sueños;YoSoyPlex;Entretenimiento Cómico;https://www.youtube.com/watch?v=WvZ0PvvTEUU;2022-03-23T19:45:01Z;2022;3
573;MNPviYqfI-I;EL SECRETO de MIKE CHIQUITO 😱💎  Las Perrerías de Mike Ep. 9 (Temporada 2);Mikecrack;Entretenimiento Animado;https://www.youtube.com/watch?v=MNPviYqfI-I;2022-03-06T21:30:11Z;2022;3
574;eJqni13UUj0;CUANDO POR FIN TOCAS EL MARCO DE LA PUERTA 🚪 #shorts;Pedro Palencia;Entretenimiento Cómico;https://www.youtube.com/watch?v=eJqni13UUj0;2022-03-06T16:39:16Z;2022;3
575;5CK5J3OpLZA;Los Niños En 2027 😂🚀 Paul Ferrer #Short;Paul Ferrer Shorts;Entretenimiento Cómico;https://www.youtube.com/watch?v=5CK5J3OpLZA;2022-03-17T20:40:49Z;2022;3
576;V_4c1aFL8SA;CÓMO hacerse un TEST 🦠 🇺🇸vs🇷🇺 #shorts #tiktok #youtubeshorts #tiktokshorts;AlesGF;Entretenimiento Educativo;https://www.youtube.com/watch?v=V_4c1aFL8SA;2022-03-11T15:27:43Z;2022;3
577;XqIAFEp-4Xw;Samsung vs Iphone 😂🚀 Paul Ferrer #Short #Tiktok;Paul Ferrer Shorts;Entretenimiento Cómico;https://www.youtube.com/watch?v=XqIAFEp-4Xw;2022-03-09T21:02:22Z;2022;3
578;LZ0A61qurfQ;LA DESPEDIDA DE ROBERTA 🥺💔 Las Perrerías de Mike Ep. 10 (Temporada 2);Mikecrack;Entretenimiento Animado;https://www.youtube.com/watch?v=LZ0A61qurfQ;2022-03-20T22:00:11Z;2022;3
579;DjdUEyjx8GM;【 LIVE 】東京都 新宿 歌舞伎町 24時間 ライブ / Tokyo Shinjuku Kabukicho Live;歌舞伎町 ライブ ちゃんねる『 Kabukicho Live Channel 』;Live;https://www.youtube.com/watch?v=DjdUEyjx8GM;2022-03-24T09:54:16Z;2022;3
